Entry,body,expanded_info,img_path,caption
Ilsan,Zabrak student at the Echani training facility.,,,
Inspector Atrus,Security investigator sent to New Orvos to evaluate the breach caused by Kavin when looking for information on Project Hydra.,,,
Ira,Fallen jedi who was the former padawan of Master Aldin and secretly his daughter as well. She ultimately killed him during her betrayal and slaughter of those inhabiting the Tomb of Vexa Chur.,,,
Irisi,See Irizi,,,
Irizi,"One of the Nine--major Chiss families that command immense power. House Irizi is currently maintaining a massive enclave on Mirial where they manufacture ships and armor for the highest bidder--which is currently the New Order of imperial remnants under Thrawn. However, not all members of the family are thrilled with this alliance--Kavin's sister included. We managed to sneak a tracking beacon onto one of their ships that successfully located its destination for General Barris and the Republic.",,,
ISD Chimaera,Apparently new or experimental Imperial Star Destroyer under the command of Grand Admiral Thrawn. Troopers and officers from this feared vessel typically display dark grey colors with blue trimming. The Chimaera is currently in the Outer Rim.,,,
ISD Fury,Imperial corvette flying with the ISD Stormbringer that pursued us to Votaris but had to pull back due to damage from the chaotic region.,,,
ISD Invictus,Imperial patrol frigate that pursued us on our first mission as a team.,,,
ISD Leviathan,Star Destroyer under the command of Grand Admiral Sloane. Troopers and officers from this feared vessel typically display dark grey colors with blue trim.,,,
ISD Predator,Ship under the command of Captain Jarl Starblade during the Galactic Civil War.,,,
ISD Stormbringer,Imperial frigate that pursued us to Votaris but had to pull back due to damage from the chaotic region.,,,
ISD Tarkin,"Imperial Frigate that received the new, powerful ships created by House Irizi on Mirial. It received the one fighter that we bugged before it jumped to hyperspace.",,,
ISD Vengeance,"Flagship of Admiral Valeria Drayk and the former 12th Fleet, now the Shadow's Hand.",,,
Isiele Braden,Zeltron singer/diva that was the talk of the voyage for the Olympus.,,,
Iskaayuma,"City on Rodia, akin to real life Chicago.",,,
Jaeger Squadron,"Elite squadron of Republic fighters, commanded by Khay's ex Asha. (Jaeger means hunter in German)",,,
Jagar Squadron,See Jaeger Squadron,,,
Jäger Squadron,See Jaeger Squadron,,,
Jakra,Khoren scout on Abrinov.,,,
Jaxima,Crixa Ageem's former superior in Rodian law enforcement. She died in a speeder 'accident' three days after the Siren's Call went missing.,,,
Jedha,"Jedha, also known as the Pilgrim Moon, or as the Cold Moon, or the Kyber Heart, and formerly known as NiJedha, was a small desert moon which orbited the planet NaJedha. Located in the Jedha system of the galaxy's Mid Rim, the moon had a cold climate due to its lasting winter. The historical and spiritual significance of Jedha led the moon to become a world of worship for those who believed in the Force, and a holy site for pilgrims who sought spiritual guidance. Was the location of the Tomb of Vexa Chur, where we discovered a holocron that aided us in our missions and understanding of the Force. The trials of which still haunt us to this day--including the revelation of a Koss family lightsaber.",,,
Jedi,"Order of stuffy, nerdy, and hypocritical Force users who were upended by their own arrogance. A group of which we are decidedly not a part.",,,
Jek,Tech at a workshop that we traded with for the reinforced shield generator on the bucket.,,,
Jenna Terrantea,"Human female acolyte in the Order of the Dark Star. She was killed by Vi in the failed assassination of a Senator on Coruscant, with her Zabrak master only getting away with one of her lightsabers. Using psychometry on the other one, Khay discovered Var was the leader of the Order of the Dark Star and had her first visions of the Krynn before even knowing what they were.",,,
Jess,"Human Republic tech originally stationed on New Orvos. She had a short, dating relationship with Kavin that ended amgiguously (a chance?). Kavin used her credential to access the New Orvos secure servers to get us more information on Project Hydra. He got what he wanted, but the breach was easily discoverable. In order to cover his tracks, he later went back and sabotaged the servers too well--the chaos that resulted from this act eventually led to the downscaling of operations on New Orvos and led to Jess being restationed. 

She later contacted us after our time with the Echani to give us a new lead on the Order of the Darkstar--the planet Zyrakar.",,,
Jofa,Quarren on Caldara Station who was a contact for Culkoo.,,,
Jorin,"Dark-haired human male on Valsura who offered to be our guide for 50 credits (underestimated our funds based on his assessment of the Bucket). He happily guided us to the Fish Market for Vi's armor, but more and more reluctantly he guided us to the shady and seedy parts of town while we looked for trouble aka Var.",,jorin.png,"A handsome younger man with a quick, easy smile."
Joris,"Local mechanic outside the Sarlacc Pit bar on Tatooine, chatted with Culkoo.",,,
Jorus,See Major Kal Juros,,,
Jrick,"""The Rodian,"" an extremely talented and ruthless bounty hunter known to Culkoo. He joined the Twin Suns splinter group.",,,
Jurus,See Major Kal Juros,,,
Juyo,"Form VII, also known as Juyo in High Galactic, the Way of the Vornskr, or the Ferocity Form, was the seventh of seven forms recognized as canon for lightsaber combat by the last Jedi Council of the Old Jedi Order. In use, millennia before the Battle of Yavin, the Juyo incarnation of Form VII was described as the most vicious form of lightsaber combat and was said to involve a significant internal focus on the part of the user.",,,
Jyn,Female scavenger encountered at Quantham.,,,
Jyrost,"Remote, cold planet and last known location of Dr. Keldan before his assassination. Where we found Eilin.",,,
Kaderyn River,"Large river on the Tholothian Crest. Approximately 20-30 meters wide at the narrowest point, we had to cross it during our quest for new crystals and enlightenment.",,,
Kalgus the Hutt,Hutt who runs a shipyard on Kiru who also stole some bacta from the Republic. We got it back with weird challenges and being awesome.,,,
Kandala,"One of the last Sith purebloods still around. She began teaching others after we 'revived' her from a crystal seed of, coincidentally, one of the last Embara trees. Her existence is a heavily guarded Republic secret as of now, but her influence is far--as she 'upgrades' she gave us after discovering her and an associated holocron were the sparks for our initial Force journey.",,,
Kandella,See Kandala,,,
Kara Adun,See Kara Adune,,,
Kara Adune,"Presumably a powerful Force user, with certainly mysterious history. The tomb of which was a primary attraction on the Olympus. May have been released or somehow tampered with during the disaster aboard the luxury liner. Originally found on Dathomir, it was protected by ghosts of Dathomiri Force users--probably Nightsisters.",,,
Karrik,Republic Twi'lek ambassador to Farpoint Station on Pranrock III. He gave us information about the area and advised us to find a Navigator at the Halcyon Club. Also he hugged us?,,,
Karris Collective,Cartel running Voss Prime,,,
Karthi (KG438),"Planet in the Unknown Regions where a new threat from beyond our galaxy is alleged to be emerging. Likely in the Anosh system, powers in the surrounding sectors were very concerned about this new faction.",,,
Kattada,Planet near the remains of Alderaan. The former Imperial resort city Haleoda is the site of the Olympus' fateful voyage.,,,
Kavin (Thrak'avi'naktomi),"Technician, mechanic, outlaw, nipple boy--he goes by many names.",,kavin.png,Himbo Chissins
Kazzan,Proprietor of the Blue Water on Haccara. Gave us a guy a who would know where to find a shard rifle and vaporators.,,,
Keela,"Nine year old, spunky, mouthy Twi'lek girl originally met on Bitronia. Since rescuing her and Rook, they wormed their way into our hearts, and Khay and Vi eventually adopted them. Keela was a technical prodigy--repairing almost all on her own the ship we used to escape Bitronia. She was originally from Ryloth, but her family's farm was forcefully taken over by local bully Thrax over a water rights dispute. She left her brother Torin in Thrax's care out of fear the separation would traumatize him--even though Thrax is the one responsible for her family's pain. She and Rook also were lured to a shipyard on New Endor where they were captured by the Pykes and used as leverage against us. While we got Rook back with a simple heist on Cinta, Keela was sold into slavery on Kessel after our 'failure' to die during the mission on the Olympus. As a member of our family, we moved the fucking galaxy to rescue her from Kessel, though we weren't able to get there before she lost her arm in the chaos, which is one of Vi's greatest regrets. Currently, she and Rook are with the Echani Order on the Tholothian Crest--left there to hopefully keep them safe while we pursue the Order of the Darkstar.",,,
Keela To,"Extremely talkative yet talented Twi'lek medic, who served in the rebellion with Vi and dated her for a while. She was the last serious girlfriend Vi had before meeting Khay. Her fate after the rebellion is uknown, but she was discreetly Force sensitive.",,,
Kel,Orm's second in command. Encountered on Ulara.,,,
Kelden,See Dr. Keldan or Eilin Keldan,,,
Kella,"Beautiful but obscure forest world. While it used to be home to lush forests filled with Darkstar trees, recent logging operations led by Freya Sett of Black Suns mercenary group have been using the local Welliks as a slave labor force to harvest and destroy their beautiful yet lucrative home. Having a personal vendetta against Freya, Cho led us to liberate the slaves and personally killed Freya, but the cost of such a crusade took the largest toll on Khay, who shot down a luxury liner hoping to aid the effort. Even accordin gto Mother Ukada it was the right thing to do, but Khay will always have her conflicted doubts about the matter.","Overview:

Kella, a lush and vibrant moon, is home to the Wellick, a sentient species of deer-like humanoids. This serene moon is renowned for its dense, mystical forests, teeming with diverse flora and fauna. The most notable are the Darkstar Trees, known for their spiritual significance and connection to the Force, as well as their valuable dark hardwood.

Current Crisis:

The Black Sun Cartel, exploiting Kella's resources, has initiated large-scale harvesting operations, primarily targeting the Darkstar Trees. This rampant deforestation is not just a commercial venture; it's a systematic destruction of the moon's ecosystem. The environmental impact is catastrophic, with widespread devastation affecting not only the forests but also the native wildlife and the Wellick communities.

Impact on the Environment and Inhabitants:

The relentless harvesting has led to a drastic change in the landscape, with once-thriving forests turning into barren wastelands. The destruction of the Darkstar Trees disrupts the natural balance, endangering numerous species and destabilizing the ecosystem. The Wellick, whose culture and way of life are intricately tied to the forests, face an existential crisis. Their sacred connection to the Darkstar Trees and the land is being severed, leading to cultural erosion and a loss of identity.

Key Figures in the Operation:

- Cell Leader Freya Sett: A former Imperial officer, now a high-ranking member of the Black Sun Cartel. Known for her ruthless approach, Freya Sett oversees the exploitation of Darkstar Wood, showing little regard for the indigenous population or the environmental impact. Her harsh methods and disregard for the Wellick's cultural values have intensified the conflict on Kella.

- Jerex Croft: The head of operations on Kella Station, Jerex Croft is responsible for the day-to-day management of the harvesting. He resents Freya Sett's oversight, viewing her as an outsider who complicates his operations. His contempt for her methods and her background as a former Imperial adds tension within the ranks of the operation.

Resistance and Hope:

In the face of this overwhelming adversity, the Wellick, along with sympathetic factions, have started to organize resistance efforts. Covert operations to sabotage the harvesting machinery and rescue enslaved Wellick are becoming more frequent. The situation on Kella is dire, but the resolve of its inhabitants to protect their home offers a glimmer of hope in these dark times.

Conclusion:

The struggle for Kella is not just a local issue but a poignant example of the larger conflicts that plague the galaxy. It's a battle between exploitation and preservation, between the greed of powerful factions and the resilience of native populations. The fate of Kella and its inhabitants hangs in the balance, a testament to the enduring struggle for freedom and dignity in the face of oppression.",kella.png,The beautiful forests of Kella.
Kellis,Information broker encountered by Culkoo during her vision in the Deception trial on Votaris.,,,
Keltar,Planet in the Unknown Regions which was the last posting of Shauna Vex before she was betrayed and sold into slavery by her former crew.,,,
Kestrel,Republic medical frigate. During recovery on this vessel is when we received our orders to capture or kill Senator Brin Aldir.,,,
Keyla,See Keela,,,
Khay,See Khaylia Koss-Starblade,,,
Khaybear,Treasured stuffed animal of Khaylia Starblade during her childhood.,,,
Khaylia Koss-Starblade,"[Placeholder] Hottest pilot, wife, human, etc in the 'verse. During her time in Black Nebula Squadron, her call sign was BN3, while she switched to Echo 7 when she joined the Rebellion.",,khay.png,Swoon
Khoren,"Grey skinned humanoid with dark hair and red eyes- they look like Chiss but they are grey instead of blue. ""Ideal slave race"" according to the Imperials.",,,
Khrax,Bounty hunter who attacked Jira at his farmstead--recognized by Culkoo.,,,
Kiara,Human commander who really doesn't like us.,,,
King Haldor,"Former King of the planet Ulara. His son, Orm, and daughter, Krenda, were opposed with each other and supported the Republic and Imperial Remnant, respectively. He was assassinated along with Orm in a pro-Imperial plot to blame the Republic and increase Imperial influence on the heavily important strategic resources the planet had to offer.",,,
Kiru,Planet where Kalgus the Hutt operated and where the gangster kept a large amount of bacta stolen from the Republic. We repossessed it.,,,
Korath,"Powerful entity, believed to be a deity, worshipped by the Krynn. They believe the Darkstar is a fragment of this being. They wish to reshape the galaxy in its image.",,,
Korrath,See Korath,,,
Korthium Crystal,"Unique kyber crystals from Alastea, found among the less-valuable korohite crystals that were the subject of the original mining operation in the region. These crystals were the first ones we ever obatined for ourselves--with Vi even putting one in the double-bladed saber she took from Amata. Obtaining them was not easy, as the abandoned mine was still infested by vicious spiders known as Krykna.

These crystals were uniquely connected to the life force of living beings--allowing us to better and more naturally perceive nearby lifeforms.",,krykna.png,Infant form of the species infesting the mines.
Koss,"Vi's family line on her father's side. Over 9,000 years BBY, the Koss family was part of a major gold rush to ancient, alien artifacts that were unearthed on Mirial. Finding, collecting, studying, and selling these objects is how the Koss famiy originally rose to power, amassing a great fortune with which to acquire yet more artifacts and other business interests.",,,
Kotala,Female Zygerian slaver who liked to beat slaves with her energy whip. She was easily dispatched by Culkoo and her garrotte. ,,,
Kouhuns,"Insectoid species that was contents of two tubes that Culkoo and Cho delivered. They are often used by bounty hunters to kill from a distance, and these were no different as they very likely were the weapon used in an assassination of a Chiss delegate on Coruscant.",,,
Kraymire,Settlement on Waylosh that was attacked by the Black Suns splinter group the Twin Suns. Locals were forced to work in the mines while they brought in a mobile ore processor.,,,
Kreda,"Pro-Imperial daughter of King Haldor on Ulara. Advised by Koru, who we know was bad news.",,,
Kree,Jawa on Wolak who directed Culkoo to a job while we investigated the Shadow Collective.,,,
Krel,"Zabrak member of the Order of the Darkstar who, along with Jenna Terrantea, attempted to stop us from foiling the terrorist plot involving the statue of Mon Mothma. While Vi killed Jenna, Krel escaped, angry and defeated.",,,
Krispin,Security officer on the Eclipse.,,,
Krykna,Origin species of the offshoot spider species we encountered in the mines of Alastea.,"Krykna were predatory, non-sentient, spider-like creatures native to Atollon. They were resistant to blaster bolts and highly sensitive to negative emotions, making them extremely difficult to tame with the Force. They were repelled by the signal emitted by sensor beacons.",,
Krynn,"Ancient insectoid race, strong in the Dark side of the Force. Worshippers of the ""Dark Star"", they believe all who use the Force are stealing from their god. They are a mostly unknown threat to the galaxy at large,hailing literally from the Unknown Regions, but may prove its undoing if left unchecked regardless of their obscurity.",,krynn_logo_full.png,Krynn symbol
Krythara,Beautiful but enigmatic planet with bioluminous life and scenery. Location of the temple where we found the Force vergeance star map.,,,
Kulgus,See Kalgus the Hutt,,,
Kyela,See Keela,,,
Kyros 2,Planet that was the target of an Imperial Remnant assault around the same time we were sent to Quatham Station.,,,
Lady Ravana,Figure who had hidden motivations that Culkoo needed to uncover during her vision in the Deception trial on Votaris.,,,
Lambda,Codename for Amaya Barris,,,
Lamda,See Lambda,,,
Lanah Grottil,Deceased Jedi whose tomb we encountered in the Tomb of Vexa Chur.,,,
Leeonia,Leoonia (Boehle’oon),,,
Leoonia (Boehle’oon),8 year old Chiss navigator girl who was kidnapped on Coruscant. Ultimately rescued by us during a train job.,,,
Leora Tarri,See Liora Tarri,,,
Lessu,"Town on Ryloth built into a canyon system, where Keela was originally born and Rook was taken in by her family. A local fruit produced what Keela called ""Blue Fruit"" juice, and we asked G2P0 to take some samples to try growing it on the Bucket.",,,
Lieutenant Commander Aeron Starblade,"Youngest son of Jarl and Shamish Starblade, attended the Royal Imperial Academy and joined the Imperial Army and was stationed in Scarif as artillery. Growing up, he was very close with Khay and had a rough and tumble personality--almost reminiscent of her future wife. Of all the Starblade children, he stood out the most, as he was the only one to actually struggle in the Academy. He and Khay fought a lot as kids, which was worsened by the fact the older brothers were at school while the parents were at work. At one point he even walked in on Khay having 'relations' with Treeya, the sister of one of her eldest brother's best friends. DOB: 21 BBY",,aeron_starblade.png,Like Fabio and Anakin had a baby
Lieutenant Commander Diallo,One of Kavin's former instructors in the Empire. Was involved in a Remnant plot to disperse a viral bioweapon on Coruscant using weather droids. Ultimately foiled by Kavin's Kavining.,,,
Lieutenant Griff Arten,Former Rebellion soldier who served under the same commander as Vi. She knew him as Crazy Arty. Encountered on Bitronia while rescuing a squad of New Republic soldiers.,,,
Lieutenant Odona,New recruit in the Republic whose family was formerly Imperial--a fact she hid by slicing into Republic computers and erasing. Kavin tracked this down and used it to blackmail her into helping him sabotage the computer systems on New Orvos to hide his own screw up from before with Jess.,,,
Lieutenant Travins,"Scruffy, dark haired, green eyed Republic officer in Abrinov system. Received our report after rescruing Kandala and Khay's receiving 'upgrades'.",,,
Liora Tarri,"One of Vi's cousins, very flirtatious with fucking Kavin. She's a bit shadier than your average Tarri/Koss, and helped hook Kavin up with a bit of spice. She met Thrawn once and is attracted to rare and beautiful things, which apparently she thinks Kavin is one?",,,
Lira Wessex,Former republic pilot promoted to base commander at Echo Base Sigma. Stressed over protecting the region with such limited resources.,,,
Lirrokwa,Wookie friend of Terrick Tan,,,
Lisandra,Deligate of House Irizi who met with us before allowing Kavin to meet with his sister.,,,
Loram,See Lorem,,,
Lord Renlu,Ithorian owner of the Sarlacc Pit Bar and also slaver. Has a close working relationship with the Pykes. We did once say we'd come back and free them…,,,
Lorem,"Chauffeur for the Koss family, slightly older than Vi. Was ""one of the good ones"" according to Vi, who had genuine affection for him.",,,
Lorna,Information broker operating out (and maybe owner?) of the Scarlet Shadow. She gave us the lead on Nebula's last location at the cannery--for 500 credits. Told us too many people were asking about the Order of the Darkstar. Maybe we should keep an eye on her.,,lorna.png,She's seen some shit.
Lumina Station,Former base of the Argent Circle on the Arami System near Hutt space. ,,,
Luminastag,Deer-like bioluminscent creatures that were Force sensitive. Encountered on Krythara.,,,
Luminoustag,See Luminastag,,,
Lurraven,"Strange avians encountered on Valsura. While most were wild, some were tamed or somehow otherwise under the control of the Order of the Darkstar and were used to spy on us.",,lurraven.png,Quote the Lurraven: Surprise Motherfucker!
Madilon,"Mineral mined on Waylosh. It is very elastic while having a high tensile strength--both good properties for hyperdrives. However, the mining was quite toxic. Other properties caused it to often interfere with communications--at least according to Cho.",,,
Major Kaelan Terrik,"High ranking officer serving under Admiral Drayk. They were involved in the faction's operations in the Nihlus Veil and on Votaris, attempting to retrieve the Aeon Codex for themselves.",,,
Major Kal Juros,Our former commanding officer during our time with Epsilon proper before we were transferred to General Barris. Associated with Gold Team.,,,
Major Quintura,"Leader of Task Force 151, responsible for capturing fugitives from the Republic--which at the time we were because of the Pykes enslaving our child. Was also Doc's commanding officer for the time.",,,
Makashi,"Form II, also known as Makashi, The Way of the Ysalamiri, or The Contention Form, was the second of the seven classic forms of lightsaber combat. Makashi was the most dueling-centric of the seven classical forms. Form II allowed an initiate to defend themselves against an opponent with minimal effort, while placing a heavy focus on avoiding disarmament.",,,
Makken (Mac),"Older, strong Klatoonian who accompanied us on our training journey for the Echani. Could not hear the crystals on his first attempt, this was his second.",,,
Marsar,Mineral used for droids. Mined on Cinta.,,,
Master Aldin,Jedi who was the leader in the Tomb of Vexa Chur. He was killed by his padawan and daughter Ira when she betrayed him and his followers. His presence lived on in a golem that protected the Tomb from further interlopers--until we destroyed it and freed him in the process. He helped us to craft our lightsabers and allowed us to use the remaining supplies in the Tomb before asking us to bury it and never let anyone discover it again.,,,
Master Ferren,"Jedi master in the Tomb of Vexa Chur, was the owner of K-7.",,,
Master Liora Vayal,"Force ghost in the sacred grove on the Tholothian Crest. A former guardian of the Jedi Order, she eventually became the guardian of the grove and guided us in creation of (some of our second) our lightsabers.",,,
Master Tarik,Custodian of the Jedi Temple who escaped Order 66. He was sought out by many as a sage and by at least one person as a blood donor--Dr. Starblade. His blood was used to make clones with a strong connection to the Force--one of which includes Khay (against her will!) and likely the clone of Palpatine we fought on Bet'su.,,,
Mekren,Culkoo's human partner during her pit fight on Haccara in front of Endara.,,,
Merken,See Mekren,,,
Merrick Tosch,"Charismatic political candidate representing Imperial interests on Haccara. His talking points included working with the UPA and rebuilding a better Haccara. He disagreed with Endara about the use of power, though, so maybe he wasn't all bad? Furthermore, his ideas were oddly inclusive for an imperial and drew crowds of non-human supporters. Instigators tried and failed to assassinate him, including one using a Huttese shard rifle.",,,
Mira Kast,Mandalorian granddaughter of Rook Kast. She sports purple hair and wears her mother's armor--nor was she intimidated by Vi's saber. Possible leader or high ranking member of the Shadow Collective.,,,
Mistress Aria,Contact in the Nax'ari Syndicate. Used Culkoo's niece Talia as a bargaining chip.,,,
Moloco,Shady arms and drug dealer on Tatooine.,,,
Morga,Sith Inquisitor who was a companion to Endara.,,,
Morven Rask,"Force master of the Echani tradition. Tried to claim the Aeon Codex for himself to fight the Krynn, but instead offered to train Khay and her crew in his ways with the hope they would join his cause.",,morven_rask.png,"Initially sus, he's cool now."
