Entry,body,expanded_info,img_path,caption
N.R.S. Phoenix,New Republic ship we were brought to by Doc after our transgressions against the Republic while trying to get the kids back.,,,
Nala Se,Kaminoan cloning expert recruited by Dr. Starblade to help in Project Khaybear. She may be the only one responsible for Khay's breaking free of Dr. Starblade's attempt to implant Imperial conditioning into Khay's genome.,,,
Nali Darkstar,"TIE pilot whose helmet stayed on Endor's moon long after the battle where Vi and Khay met. Years later during a romantic getaway, they found the helmet while wandering through the forest for a picnic.",,,
Nax'ari Syndicate,"Shady syndicate that controlled aspects of Rodian politics. Crixa Ageem was investigating them while her brother, Torka Vosk, worked with them--a connection that ultimately got Crixa killed. Not wanting or being able to completely rock the boat on her homeworld, Culkoo left the syndicate at status quo.",,,
Nebula,"Tall, Deveronian male who was an operative/informant for the Echani Order. Disappeared during his inquiry. Last known location was at a cannery that secretly had a dock used to access the Order of the Darkstar's base.",,,
New Orvos,"Outer Rim planet that served as an early hub of operations as we were starting out in our campaign. Some unfortunate misunderstandings on the nature of Project Hydra, Jess's security access, and Kavin's (allegedly) expert slicing caused a major security breach that ultimately lead to the downscaling of operations on the planet. It was a major blow to the Republic in the sector, but we got the info we needed, right?","Sector: Outer Rim Territories

Region: Just outside Hutt Space

Planet Type: Terrestrial

Climate: Temperate

Terrain: Diverse; primarily agricultural with mountain ranges, valleys, and forested hills
Key Cities: Orvos Prime (Capital and Main Metropolitan Center), Tarrin (Secondary City and Black Market Hub)

Government: New Republic Governance with Local Elected Officials

Population: Mixed; predominantly Human with a significant representation of Twi'leks, Rodians, and other Outer Rim species

Economy: Agriculture-driven with contributions from trade, technology, and black market dealings

Exports: Agricultural produce, textiles, technology parts

Imports: Machinery, luxury goods, spices

Allegiance: New Republic

New Republic Base: Fortitude Outpost (Strategically located within proximity to Orvos Prime for logistic support and rapid deployment)

Black Market Influence: While the New Republic maintains official governance, the proximity to Hutt space has allowed for a thriving black market, primarily run through Tarrin. Smugglers, bounty hunters, and traders frequent the city, dealing in everything from rare artifacts to embargoed goods.

Description: 

New Orvos is a beacon of New Republic ideals in the Outer Rim. It's lush and fertile lands are dotted with vast stretches of farmland that feed not only its population but also contribute to the food supply in the region. However, the planet's serene exterior belies the bustling activity of its metropolitan centers.

Orvos Prime, the capital city, is a hub of political activity and houses the main base of New Republic operations on the planet. It is characterized by its orderly city planning, well-maintained public facilities, and the presence of New Republic troops that ensure the safety and upholding of the law.

Tarrin, on the other hand, is the polar opposite. Nestled among the mountain ranges, it is the unofficial capital of the planet's black market. It’s a city where credits speak louder than allegiances, and where the New Republic's influence is challenged by the shadowy underworld powers that profit from the proximity to Hutt-controlled territories.

New Orvos's location makes it a strategic asset to the New Republic, providing a foothold near Hutt space from which to extend their influence into the Outer Rim. The presence of the New Republic military base, Fortitude Outpost, underscores the planet's importance. The base is a center for reconnaissance missions, a deterrent against Hutt incursions, and a refuge for those fleeing the lawlessness of the Outer Rim.

Despite the undercurrents of illicit dealings, New Orvos is a planet of opportunity. It's a place where one can witness the juxtaposition of the New Republic's ideals against the practical realities of Outer Rim living, where the untamed spirit of the frontier meets the order and organization of the New Republic's vision for the future.",new_orvos.png,New Orvos from orbit.
Nightshade Marauder,"Large, repurposed Imperial Frigate under the control of the Dusk Haven Militia. Its large gravity well generators blocked us from immediately jumping to hyperspace after recapturing The Drift. With a coordinated assault between The Drift and the Bucket, both ships were able to successfully evade the larger foe--but the Bucket may have brought an unexpected tracker beacon friend with them after escaping.",,,
Nihlus Veil,Extremely difficult patch of space with little life--but still with some planets lost to time.,,,
Okchota (Cho),"Iakaru spy, scout, operative, whatever else you really need--Cho can probably do it. After having his people slaughtered and enslaved by the Empire, he dedicated his life to fighting against them and freeing those who were oppressed--wanting to make sure he can spare as many others as possible the fate he and his people were subjected to. After taking personal revenge against Freya, the one who originally led the attack on his home, he found the Force later in life and became an Ataru Striker to capitalize on his extreme agility. He now seeks to protect the galaxy from threats within and without.",,,
Okkipo Gran,"Deveronian melee fighter involved with the Twin Suns on Waylosh. He was happy to fight Vi, but circumstances and other bullshit made him kinda win, which is bullshit. He wanted a rematch, and so does Vi--we'll see.",,,
Omega Nine,Rich area of the space port on Mirial in Vi's home city.,,,
On The Ropes,Fake Iakaru holiday that Cho made up to troll Varokis.,,,
Onda Por,Our Republic contact on Bitronia.,,,
Ooma,"Victim of Imperial experiments encountered on Treduru. She wore intricate tattoos to cover the scars she accrued while being tortured and experimented on. She gave us the lead to Quatham, and was the only one to escape that place alive. She offered to help Khay--the implication of which we did not grasp at the time.",,,
Operation Phoenix,"Project headed by Dr. Starblade during her brief stint with the New Republic. It sought to find a way to extend the life of clone troopers from the Clone Wars, but ultimately was deemed not worth pursuing. Doc was one of the few ""successful"" subjects.",,,
Operation Waking Shadow,"Plot to assassinate Senator Wren Mikkel which involved Crimson Ghost squad. Vereck Kren, a local gang member, attempted to use a bomb to kill the Senator but was foiled by someone. We investigated the aftermath.",,,
Order of the Darkstar,"Secret cabal of Force sensitives, powerful in the Dark Side and opposed to the Krynn, who use their own lightsabers crafted from the Darkstar itself--but is it corrupting them to work for the Krynn unwittingly? The Order is lead by Varkas Koss (Var)--Vi's twin brother long thought to be dead.",,darkstar_logo.png,Logo of the Order of the Darkstar
Orin Zhar,Political opponent to Torka Vosk who died mysteriously--to Vosk's advantage--during a campaign for mayor of the Rodian city of Iskaayuma.,,,
Orm,"Son of King Haldor of Ulara and pro-Republic. When shit hit the fan on Ulara with his sister Kreda's coup, we extracted him with great effort safely to the Republic.",,,
Outbound Flight Project,"Outbound Flight was an expeditionary project, led mainly by Jedi Master Jorus C'baoth, that sent a mission of six Jedi Masters, twelve Jedi Knights, and 50,000 men, women, and children beyond the borders of the Galactic Republic into the Unknown Regions where they hoped to pierce the edge of the galaxy and seek out extragalactic life.",,,
Outbound Reclamation Initiative (ORI),"Desperate attempt by the Rebellion, after the massive defeat at Hoth, to find the site of the Outbount Flight Project disaster and reclaim assets, information, or anything deemed useful. Was silently also an attempt to find Force artifacts and/or users that could help the rebels in the fight against the Empire. Its top secret nature was its ultimate demise, as the leaders of the project were forced to abandon it after results were not as quick as needed and newer intelligence implicated the second Death Star project as the immediate target for all rebel resources. Varkas Koss was one of the members of ORI believed to have been dead after it was abandoned with no clear survivors.",,,
Ozy,"Twi'lek woman who helped us gain an audient with Kalgus the Hutt, which we wanted to use as cover to recover the stolen bacta for the Republic.",,,
Paraga IV,Moon where Echo Base Sigma is located.,,,
Pesha,Goddess of the dark worshipped on Ulara.,,,
Petro,Friend of Cali and Zatt who was killed by the former. Zatt has his name tattooed on him.,,,
Phinarii,"Aquatic natives of Valsura. Their bioluminescent colors on their heads are the subject of much speculation by other races--either beautiful or used for hypnosis. Oddly, they read as voids in the Force--which is extremely unsettling to us.",,phinarii.png,Typical Phinarii
Phrikrite,Material with properties similar to beskar. Primary component of Vi's Spectre-fiber Combat Armor.,,,
PIMC Station 3 ECHO,Mining platform we used to access the caves with the korthium kyber crystals on Alastea.,,,
Pranrock III,Remote planet near an unkown and chaotic region of space. A small Republic embassy was maintined there.,,,
Progressive Coalition,Political faction in the Republic Senate that generally worked toward more independence and a weakening of the Republic. Often had clandestine support from Imperial Remnant factions and was supported by Senator Kall.,,,
Project Khaybear,"Secret project lead by Dr. Starblade to clone the daughter she lost, Khaylia. Using resources from Cerberus, she worked to clone Khay perfectly, down to her memories. While successful, she had to recruit the help Nala Se, a Kaminoan. Nala Se ultimately betrayed Dr. Starblade's trust and made modifications to Khaylia's genome allowing her to break free of the Imperial conditioning Dr. Starblade was implanting.",,,
Pytock Industrial Mining Corporation (PIMC),Company mining korothite crystals on Alastea.,,,
Qirg Yinton,Faction unaffiliated Quarren political candidate on Haccara. Wanted to build a space port to boost the economy.,,,
Q'ren,"Echani member who taught Foresee and Farsight. As a Chiss, he was a member of the Ascendency until a not-to-be-discussed event forced him out.",,,
Quantham,"Abandoned Imperial research station. This aquatic station had a surface and subaquatic levels that required different gear to access. Ooma was tortured here, among a host of other Force sensitives, as part of some twisted research. In the sector, there was also a bounty out for Dr. Starblade. Once upon a time, little Khay spent time there during her childhood.",,,
R3 (Artie),Black astromech droid originally belonging to former ISB agent codenamed Lambda.,,,
Rak Chask,Former Alliance deveronian captain who is now running the Wraiths. Chask is very charismatic and loved by his people.,,,
Rakka,Female Zygerian slaver who liked to beat slaves with her energy whip. Effortlessly bisected by Vi.,,,
Ranara,"Young, dark-haired human who is a visionary at the Echani training facility.",,,
Rase Iren,Former ISB agent and Endara's second-in-command on Haccara.,,,
Raven Tak,Male Rodian who gave us information to take aboard the Olympus.,,,
Raxul,Large aquatic monsters we fought with in the waters of Quantham. They did not like light--ergo our flares.,,,
Red Hand,Street gang on Coruscant with Imperial loyalist leanings. The Starfall Cantina was one of their main hangout spots.,,,
Rhodium,Exotic material from the Unknown Regions that became reactive when put under pressure. Verreck Kren used this material in his bomb that he tried to use to assassinate Senator Mikkel.,,,
Rhyssa,Togruda student at the Echani training facility.,,,
Rockhopper,"Species of adorable, rodent-like animals encountered around the time we went to Kiru looking for stolen bacta. Resembling kangaroo rats, they bred like rabbits though--infesting the Bucket until they were likely ousted by better infestors called the Fuzzmaws. At least they tasted good to Cho.",,rockhopper.png,Try it with peanut oil!
Rom,Duros captain of the Frenzy,,,
Rook,"Wookie companion and adopted sibling of Keela's. Somehow finding his way to Ryloth, he was raised with Keela as a member of her family until the fateful attack by Thrax that caused both of them to flee. He was believed dead after the event, but somehow found his and Keela's way to Bitronia, where they met the crew, who quickly fell in love with them. Khay and Vi consider him their son and will vehemetly fight to defend them from any harm that they can. He and Keela were both captured on New Endor while looking for their own ship, which turned out to be the start of a trap the Pykes were setting for his adopted parents. Also prodigiously curated a fine collection of wookie pornography. ",,,
Rusty Blaster,Bar on Tatooine.,,,
RY-467,Planet in the Anosh system where the Eclipse was known to have crashed.,,,
Saren Tarri,Older sister (mid 20s) to Liora and cousin to Vi.,,,
Savara Cross,"City on Zyrakar. Under control of the Dusk Haven Militia, it was a hotspot for those wanting to lay low from the Republic. It is the heart of the planet, which is itself large crossroads for galactic trade.",,,
Savek,Name found on the ID of a dead Chiss whose armor was taken by Culkoo and Kavin. Not likely this was the actual name of the person.,,,
Sayto,Wellik leader who initially distrusted us but relented when Mother Ukada vouched for us based on our connection to the Force.,,,
Scarlet Shadow,"Seedy and scary bar known to not only be a hideout for local bad guys, but also a known hub for Order of the Darkstar activity. Jorin was not pleased about going here.",,,
Scavenger's Den,"A mix of ramshackle buildings, discarded machinery, and tons of drugs. Was the location of Nebula's tracking beacon, which we found in his jacket after sneaking it away from some lower-ranking Void Claws. Jorin stayed at the Fish Market for this excursion.",,,
Selorin,"Muun contact of Caeli's. He was a finder for the Order of the Darkstar, which is why Caeli sold her Forcey things to him.",,,
Senator Brin Aldir,Renegade senator who stole a holocron from an archive on Correllia--turns out his family was being threatened. We saved him from Amata when she was threatening him.,,,
Senator Kall,Corellian senator who was pretty racist. Stood to benefit from the assassination of Senator Wren Mikkel had the attempt been successful. Leader of the opposition party.,,,
Senator Khalifa,"Senator who opposed Senator Leia, advocating that the Remnant was just rumors and there was no need to increase military spending and power.",,,
Senator Malos Adresh,"Senator involved in the government of Bitronia. Was our primary target to ""rescue"" for the New Republic--his fate is unkown, but we did not feel good about leaving him to the Republic's mercy.",,,
Senator Telran Adresh,"Brother of Malos Adresh and Senator to the Republic for his planet. He was far more pro-Republic than the demographics of his planet would imply, but maybe he was a little distant from them all the way on Coruscant? We contacted him out of concern for his brother, but he did not seem too worried. We did everything we could?",,,
Senator Wren Mikkel,"Victim of a, fortunately, unsuccessful assassination plot involving Crimson Ghost Squad and Verreck Kren. Represented Tarus 4 and was a member of the Unity Party, which favored strong relationships between citizens and governments and was in favor of staying with the New Republic.",,,
Senior Technician Orto,Kavin's fake name when he was infiltrating the main computer systems on New Orvos.,,,
Seraphara,Force Aspect of Light we encountered in the cave on the Tholothian Crest.,,,
Sergeant Farrik,Officer in charge of engineering on the Eclipse.,,,
Sevick,See Sevix Confederation,,,
Sevix Confederation,"Organization of planets for mutual interests, including defense, in response to the Republic's weakening power in the local regions. Bitronia was a member planet.",,,
Sha Gera,Rodian contact on Bespin who gave Culkoo information on her parents.,,,
Shadow Collective,"A group of pirates, Imperial remnants, and former rebels that are working together that have been taking prisoners and stealing medical supplies. They had operations on Wolak.",,,
Shadow Disciples,"Followers of Xeran Varros, our primary attackers during the frantic escape from the moon-bit-shower that rained down on the Eon Codex's location on Votaris.",,,
Shadow Wolves,Feline creatures that were rumored to hunt Jedi and to have been once active on Wolak.,,,
Shadow's Hand,"Group of Imperials working under Admiral Valeria Drayk. Their actual status in the Empire is dubious at best to our knowledge, as they do not operate in traditionally Imperial ways, often aligning with criminal elements like syndicates, cartels, and spice runners.",,,
Shahdara,Force Aspect of Dark we encountered in the cave on the Tholothian Crest.,,,
Shaltaan Day,See Shal'taan Day,,,
Shal'taan Day,Rodian holiday coinciding with elections.,,,
Shana Vex,"Former ISB agent who was captured by Finn Coran before they were both captured by Pykes to be shipped to Kessel as slaves. For rescuing her first from the Pykes and later from Finn, she rewarded us with information she was carrying that tipped us off to a plot to kill a Republic Senator--which ended up being our first encounter with the Order of the Darkstar.",,,
Shauna Vex,See Shana Vex,,,
Shien,"Form V, also known by its two primary disciplines of Shien and Djem So, was the fifth form of lightsaber combat used by members of the Jedi Order. Although it was a form geared toward and created for lightsaber-to-lightsaber combat, it was nonetheless reasonably useful for blaster deflection. The Shien variant of Form V allowed the utilization of an unconventional reverse grip.",,,
Shii-Cho,"Form I, also known as Shii-Cho, The Way of the Sarlacc, or The Determination Form, was the first of the seven forms of lightsaber combat. This combat form was developed during the transitional period within the Jedi Order from ancient metal swords to more contemporary lightsabers. As Shii-Cho was effectively an experimental combat form, and was created prior to the emergence of Dark Jedi and Sith Lords, it did not address the issue of lightsaber-to-lightsaber combat, and was quickly replaced by Form II. Despite this, Shii-Cho continued to find a niche as a training form, with almost every Jedi duelist receiving some instruction in it, and including elements in their own combat styles. Shii-Cho was considered an effective fall-back option when no other form or combat style would do.",,,
Shitani Fen,Leader of the pro-Imperial rebels in Bondar City. Our goal was to kill or capture this former Rebel.,,,
Shon,Secretary on Haccara who gave us information on the different factions.,,,
Silver Team,Doc's former unit who was made to go into a mission blind because of lost intelligence that was on New Orvos--totally not Kavin's fault.,,,
Sinta,See Cinta,,,
Siren's Call,Ship that was destroyed by the Nax'ari Syndicate with Culkoo's parents on board.,,,
Soresu,"Form III, also known as Soresu, the Way of the Mynock, or The Resilience Form was the third form of lightsaber combat created by the Jedi Order. It focused more on defense than attack and was developed in response to the growing prevalence of blasters throughout the galaxy.",,,
Spectre-fiber Combat Armor,"Armor of a former bounty hunter made of phrikrite, now in Vi's possession at the cost of her and Khay's first lightsabers. While it doesn't have all the perks of beskar or cortosis, it has lots of room for activities.",,,
Stormpike,Freighter docked on Cinta that contained a huge shipment of bacta that we 'reallocated' in the name of Keela.,,,
Stormpyke,See Stormpike,,,
Sulux,Doctor from a Mercer Medical ship who attempted to get some information to Leia Organa.,,,
Systemic Artificial Being with Rational and Intelligent Networked Architecture (SABRINA),"Artificial intelligence controlling the research station on Bet'su where Khay and Trynn were originally cloned. Corrupted by an unknown event, Kavin was able to reboot and restore it to help us further venture into the facility.",,,
Taj Alvar,Entity or recording found in the holocron stolen by Senator Aldir. Gave us the location of the temple of Jedha and also access to the Sense ability.,,,
Talia Vosk,"Torka Vosk's daughter and Culkoo's cousin. She was in custody of the Nax'ari Syndicate, but Culkoo brought everything to an uneasy calm to allow her safe retrieval. Culkoo eventually left the crew of the Bucket to take care of her.",,,
Tanik Ageem,"Culkoo's father, killed in fallout from Torka Vosk's interactions with the Nax'ari Syndicate when his ship, The Siren's Call, was blown up.",,,
Tarri,"Family line of Vi's mother Vilira. A millennias-old family line of technicians, armorers, and most importantly--weapons dealers and manufacturers.",,,
Tarus 4,Planet represented in the Republic by Senator Wren Mikkel.,,,
Task Force 151,"Republic squad responsible for apprehending fugitives. Lead by Doc, they brought us in after bringing us into custody on Tatooine.",,,
Temple of Starlight,"Ancient temple housing the star map of Force vergeances pursued by us and the Order of the Darkstar. Originally protected by forcey, flesh gollem things, the temple was unfortunately destroyed either by our removal or the star map, our clash with the Order of the Darkstar, or likely both.",,,
Terentatek,Ancient Sith-bred creature that was Force sensitive and used to hunt them. It was used to punish the Pykes' enemies in their pit fights.,"Terentateks were a species of hulking bipeds found on the arboreal planet of Kashyyyk that craved the blood of Force-sensitives. Terentatek were large, brutish creatures covered in spines. Although similar to rancors, they were typically smaller than them. Their heads, crowned by a number of long spikes, featured two small eyes, a large mouth filled with sharp fangs flanked by two tusks, and a downward pointed chin. Their upper limbs ended in three clawed digits. The color of their rough-looking skin ranged from mottled-brown to blue with yellow patches.",terentatek.png,#NotARancor
Terrick,Imperial that khay went to school with who got us the job on Wolok.,,,
Terrin,Cloaked man who approached Caeli Tarn who told her she never should have sold a crystalline obelisk that she found.,,,
Tessa,"Twi'lek woman in Lessu who knew Keela before we adopted her. She got along with Kavin very well, as she was a fellow gearhead.",,,
The Flow of Balance,"Echani meditation practice, emphasizing the balance between light and dark (resembling IRL Tai Chi).",,,
The Fuckit-Bucket,"Our YT-2000 freighter that's seen its share of pain. Kavin keeps her together, with spit and wishes sometimes, but somehow she's always pulled through. To Vi's great annoyance, the protocol droid who registered their name in the database as the Duckit-Bucket due to autocorrect, so their designation is DB-1. Though sometimes, since falling in with some rough crowds and needing to hide their past bounties or affiliations, they use a second transponder under the name ""The Spicy Rancor.""",,,
The Hand,"Enigmatic and terrifying member of the Order of the Darkstar. All we can really tell about him is that he's around 6'3"" and wears armor and coverings over his entire body. He was present in Khay's vision of Nebula she received from using psychometry on his jacket and also present in the cannery during our infiltration.",,the_hand.png,"Seriously creepy vibes, man."
Thelania Voss,"Former Jedi who left the Order around the same time as Rask. She teaches meditation, Soresu, and Ataru techniques. Currently in a relationship with Ezor Desh",,,
Tholothian Crest,Rask's training facility.,,,
Thrax,"Local bully around Lessu who believed the water--that he was unaware of--on land he sold to Keela's family was rightfully his. He initiatied a hostile takeover--literally--and forced out/ended Keela's parents and caused Keela and Rook to flee. He adopted Torin as his own, who knows nothing of the heinous things his adoptive father has done, and he also wanted to adopt Keela when he found out she was alive too. We politely declined.",,,
Tidehaven,City on Valsura where we landed to pursue Var.,,valsura_fish_market.png,"The ""Fish Market' on Valsura"
Tilari Tarri,Vi's aunt.,,,
Toarak Brothers,Mechanics on Coruscant that Kavin knew who also provided a contact for Keela's needs.,,,
Tomb of Kara Adune,Found on Dathomir. Was a major attraction aboard the luxury liner Olympus and was likely opened during the disaster during its fateful final voyage. Current status unknown.,,,
Torin,Keela's brother who stayed behind on Ryloth after Thrax's hostile takeover of the family farm.,,,
Torka Vosk,"Culkoo's political uncle who amassed quite a bit of power in Rodian politics and eventually the Republic, but his ties with shadier elements always haunted him personally, if not professionally. His dealings with the Nax'ari Syndicate are the reason his sister and brother-in-law were killed.",,,
Treduru,Moon with a breathable atmosphere that hosted the Starlight casino and also where we met Ooma.,,,
Trev,Young Pandoran who was enslaved by the Pykes on Kessel with Keela. He was very protective of her and helped us get her to safety during the rescue.,,,
