Entry,body,expanded_info,img_path,caption,category
Varkas Koss (Var),"Vi's younger twin brother (by four minutes!). During the rebellion, after the loss of the rebel base on Hoth, Var volunteered for what was known even then as a near-certain suicide mission--the Outbount Reclamation Initiative (ORI). Overconfident in his abilities as a fighter and combat engineer, Var eagerly went on the mission to bring recognition to his family (or to himself from his family?). Unfortunately, the mission was the predicted disaster, and Var was long thought to be dead as the rebellion refocused their efforts on the emerging threat of the second Death Star.

However, Var survived and returned as the powerful Lord Var and leader of the enigmatic Order of the Darkstar--a Dark side cult dedicated to following the crystalline Darkstar in order to stop the Krynn and amass power for their own ends. However, Var's ascension to leader did not sit well with some more traditional members of the cult. They believed Var took them away from their intended purpose of fighting the Krynn by all means--alleging that Var was accumulating power only for himself. Furthermore, they believed Var was polluting the Order's purity by partnering with outside parties, like Thrawn's 7th Fleet, the Chimaera legion.

When Vi released Jaxsen Tarn, a proponent of the Order's old ways, Jaxsen nominated Vi as his champion to duel Var in the Ritual of Kaggath--a fight to the death. Vi accepted, but she secretly had no intention at all of killing her brother and told her wife to plan accordingly. Kavin and Cho also planned accordingly, so Vi fought Var in their fated duel at a disadvantage using her mother's lightsaber in order to stun her lost brother and nearly won. Var then manifested supernatural power--presumably empowerment or even possession by the Darkstar itself--and drove Vi underground and nearly killed her until her crew/family intervened. Khay rushed in and healed her injured wife while Kavin and Cho created enough chaos to give us a fighting chance to actually escape with Var, the estranged fallen twin brother, intact.",,var.png,You don't want to know what those tattoos mean.,people
"""Sergeant"" Finn Coran",Bounty hunter masquerading as a Republic soldier. Had Shana Vax in his captivity while we were rescruing Keela on board the Crimson Princess.,,,,people
Abrinov,"Recently discovered planet, New Republic settlement, with Khoren Refugees making a homestead, also the site of an old Sith temple",,,,planets and regions
Admiral Garret Thorne,Soldier involved in overseeing Cerberus.,,,,people
Admiral Valeria Drayk,"Human female leading the Shadow's Hand fleet--formerly the 12th Imperial Fleet. Her flagship, the ISD Vengeance, is the one that pursued us to Votaris seeking the Eon Codex.",,,,people
Aeon Codex,Incredibly powerful device used by ancient Sith to channel the Dark side of the Force. It grants the bound user immense power at the cost of eventually consuming them. Currently bound to Khay and housed in an extremely secure vault on the Tholothian Crest--the training grounds for the Echani Order. The party originally found it on Votaris. Heavily sought by the Order of the Darkstar,,,,objects
Ageem,Culkoo's family name and line.,,,,people
Agora,Odd hybrid creatures that were results of experimentations done on the Eclipse. Known to cause problems with perception and induce nausea.,,,,other entities
Agore,See Agora,,,,other entities
Aika,Young Wellik translator who helped us with Sayto and Mother Ukada,,,,people
Ajax,Rodian techy encountered on New Orvos during the party's initial recruitment.,,,,people
Akuna Corporation,Shell corporation on Coruscant. Masked their true activity of manufacturing chemical weapons for the Imperial Remnant.,,,,organizations
Alastea,See Alestea,,,,planets and regions
Alastea,See Alestea,,,,planets and regions
Alderaan Fragment,Crystalline fragment of Alderaan in possession of Varokis Koss.,,,,objects
Alek,Jess's cousin on Haccara--in the farming sector.,,,,people
Alestea,Ice moon with a former mining operation. Where we found our original korthium kyber crystals.,,,,planets and regions
Alia,Leader of the Falling Star Mercenary Company.,,,,people
Alira,Name given to us on Haccara after we tested positive for something (it was the Force but they didn't really understand it).,,,,people
Almira,Goddess of the light worshipped on Ulara.,,,,other entities
Alran,"Pilot of the Crimson Princess, the slaver ship we commandeered to get to Kessel to rescue Keela.",,,,people
Amata,"Apprentice involved in the false flag operation on Ulara. She had protruding veins and an addiction to some inhaler--characteristics of those who made it out of Dr. Starblade's experiments alive. Vi took her red, double-bladed lightsaber after killing her--Vi's first actual lightsaber.",,,,people
Amaya Barris,"Former ISB agent, but still very young. She defected with Artie, trying to sell her information to the highest bidder--maybe the Black Sun?",,,,people
Anian,"Young, female pilot working for the New Republic. Also good with computers.",,,,people
Anosh System,Highly radioactive zone in Uknown Space. Last known location of the Eclipse and Dr. Starblade (as far as the New Republic is concerned).,,,,planets and regions
April,"Navigator of the Crimson Princess, the slaver ship we commandeered to get to Kessel to rescue Keela.",,,,people
Ara Kriss,"Zeltron encountered on Haccara. She was on board a shuttle located in the Imperial compound that we…forcefully…opened with an AT-ST cannon shot. She survived the shot, but not us.",,,,people
Arami System,System near Hutt space where Lumina Station--an old Argent Circle base--is located.,,,,planets and regions
Argent Circle,"Mercenary salvage group, they have been known to kill crews and take parts.",,,,other entities
Armando Quanti,"Weequay information broker who helped us on the start of our journeys. Working for the Republic, he has since been reassigned.",,,,people
Arra Tos,Falleen shipyard owner on New Endor. She sold us out to the Pykes and is directly responsible for Keela and Rook being enslaved.,,,,people
Artie,See R3,,,,droids
Arty,See R3,,,,droids
Asha,"Commander of Jaeger Squadron, hotshot pilot, and Khay's ex. She flew with Talon squadron, based on the ISD Justicar, before herself defecting to the Rebellion/Republic.",,,,people
Ashani,See Echani,,,,locations
Ataru,"Form IV, also known as Ataru, the Way of the Hawk-Bat, or The Aggression Form, was the fourth of the seven forms of lightsaber combat. An aggressive style, Form IV was fast-paced and effective against single opponents, though weaker in prolonged combat and confined spaces. Also, it was not recommended for use against opponents wielding blasters. Ataru was characterized by Force-assisted acrobatics, such as somersaults and leaping strikes, both for attack and defense. Another characteristic of the form was its fast strikes from multiple directions.",,,,concepts
Aurach’s Nest,Bar in Wolak City on the moon Wolak. Where we met Mira Kast.,,,,locations
Aurorans,"Natives of the planet Ylara, supported by the New Republic.",,,,people
Balu,Rando Bothan we encountered on Waylosh,,,,people
Barazal,Force Aspect of Balance we encountered in the cave on the Tholothian Crest.,,,,other entities
Bastion Colonial Corporation,Organization on Farpoint Station on Pranrock III that obtained navigation data for the Anosh region that the Republic wanted. We needed it to find the Eclipse.,,,,organizations
Baush,"Young, short wookie encountered on New Orvos during our initial enlistment into the Republic military.",,,,people
Baxta,Culkoo’s mother’s informant on Ryloth with information about Nax'ari Syndicate,,,,people
BD,Kavin's explorer droid. Very useful. Affectionately called 'Wong.',,,,droids
Beakiya Mota,Former Imperial scientist now working for the Republic. Around 52 years old. Last known location working at the Devion facility.,,,,people
Bel Starblade,"Oldest child of Jarl and Shamish Starblade, attended the Royal Imperial Academy and transferred to ISB Academy and Office in his last year, eventually serving as an ISB Loyalty Officer on the ISD Firestorm. Was more of the serious one growing up--often tattling to their nanny on his younger siblings. DOB: 25 BBY",,bel_starblade.png,Palpatine Youth,people
Betsu,"Planet with purple skies originally seen in one of Khay's visions. Was the site of top secret Imperial research headed by Dr. Starblade. Was the site of Project Cerberus and KB, the former of which still yielded a grotesque clone of Emperor Palpatine that was allegedly defeated when the site was destroyed.",,,,planets and regions
Bhalorran Bristlecat,Cat-like creature with chameleon-like abilities to change its color. We encountered one during our trials on the Tholothian Crest and ultimately convinced it to aid us rather than oppose us.,,,,other entities
Bitronia,"Planet that is part of the Sevix Confederation. Worked with the Republic in ship production, but that status is tenuous. Remnant forces are also vying for control and influence.",,,,planets and regions
Black Nebula Squadron,"Imperial Remnant squadron under the command of Commander Terrus Starblade--Khay's brother. When serving, Khay's call sign was BN3.",,,,organizations
Bluewater,Local bar on Haccara.,,,,locations
Bondar City,"City on Bitronia, location of the main political conflicts.",,,,locations
Brandis,"Twi'lek tech who tipped Doc off about the plan to assassinate a senator, which was ultimately revealed to be an Order of the Darkstar plot.",,,,people
Breos,"Moon of the planet Treduru, a safe haven for the pirate group known as the Wraiths.",,,,planets and regions
Britisa,Republic intelligence operative who received our samples of the imperial viral weapon on New Orvos.,,,,people
Bruk,Trandosian bartender of the Rusty Blaster.,,,,people
Cadera,"Ruined city on Jedha, where we found the Tomb of Vexa Chur.",,,,locations
Caeli Tarn,"Human tomb raider, encountered on Savara Cross on Zyrakar. We liberated her ship, The Drift, in return for more information on the Order of the Darkstar.",,,,people
Caelum Rexis,"Dark side master in the Order of the Darkstar, subservient to Lord Var. Attempted and failed to retrieve the star map of Force vergances when we took posession of it. Forced us to accidentally destroy the place. Bastard.",,,,people
Caldara Station,Odd settlement of three asteroids cobbled together into stations. Found near Haccara.,,,,locations
Cali,"Fallen Mirialan Jedi who worked for Freya on Kella. It took a huge effort for us to resist her power, with Vi taking the brunt of it while the rest focused on her forces. Her fate is uknown, as during the fight she and Zatt had their fated duel but were separated at some point. She was in love with Petro at one point.",,,,people
Captain Ella,"A captain Kavin asked another Chiss about once. (Episode 23, From the Ashes)",,,,people
Captain Jarl Starblade,"Originally from the Arkanis sector, Captain Starblade served as a member of the Coruscant Security Force before serving in the Clone Wars and Galactical Civil War. He captained the Imperial I Class Star Destroyer, the Predator, during the Galactical Civil War. Also Khay's dad--at least in some way.",,khay_dad.png,High ranking fascist.,people
Captain Jorel Has,"Captain of a ship that Cho once stowed away on. Instead of ejecting him, the captain let Cho stay on as a crewman. He gave us the information that Freya Sett was located on Kella doing the same thing to the native Welliks that she did to Cho's people.",,,,people
Captain Reece,"Captain of the slaver ship the Crimson Princess. He at least agreed to help us infiltrate Kessel and liberate Keela. Does that make him better, if he's not technically the one slaving?",,,,people
Captain Toren,Commanding officer of the ISD Vengeance who ordered the evacuation of all Imperial forces around Votaris and the Nihlus Veil.,,,,people
Captain Vandar,Republic soldier who helped us guard the statue of Mon Motha during our first encounter with the Order of the Darkstar.,,,,people
Cathar (faction),"Faction, presumably non-native, opposing the Aurorans in the civil war on Ylara. Supported by the Imperial Remnant.",,,,people
Cathar (species),"Species of feline, bipedal humanoids native to Cathar, a planet of savannas and rough uplands.",,,,people
Cato,Agricultural moon (or planet?) which was the site of a Remnant viral attack,,,,planets and regions
Cerberus,"Name of the Imperial project Dr. Starblade worked on, with the goal to clone the Emperor. The result of this project was encountered on Bestu when Khay confronted the source of at least some of her Force connection, yes in the form of a cybernetic Emperor (somehow). While Khay, Vi, and Kavin escaped this monster, they never quite saw a body...",,,,organizations
Cheunh,Ancient language spoken by Kandala,,,,concepts
Chief Petty Officer Marlo Vin,Officer who supplied us at Echo Base Sigma.,,,,people
Chorus Cantata,Carved bone instrument from the Chorus Cantina on Coruscant before the rise of the Empire--a bag-pipe like instrument. In possession of Varokis Koss.,,,,objects
Chryso (Kris),"Zeltron with blue hair, pink skin, and a bubbly personality. Very outgoing and intuitive, accompanied us on our training journey for the Echani. Her smell aroused us.",,,,people
Cinta,Location of the Stormpike before we 'reallocated' it for the Pykes in order to get Keela back.,,,,locations
Col (Cole),Kiffarian member of Crimson Ghost Squad. May be able to psychometry.,,col.png,Don't touch me.,people
Colonel Lyra Zarek,Soldier involved in overseeing Cerberus.,,,,people
Commander Cormin,"Republic soldier who got our accomodations in Endor City, New Endor.",,,,people
Commander Gann,Republic commander of the Kestrel.,,,,people
Commander Karis,Commanding officer who has the power to send in Jaeger Squadron. Cho implored with her to finish the job on Wylosh when we were reassigned before securing the planet for the Republic.,,,,people
Commander Terrus Starblade,"Middle son of Jarl and Shamish Starblade, attended the Royal Imperial Academy and was stationed in Lothal after graduation. Leader of the Black Nebula Squardron--call sign BN1. He was very close with Khay and somewhat of a ""man of the people""--as much as one could be while also being an Imperial. He was responsible for letting Khay fly some of her first spacecraft, likely a bit too young to be allowed to do so without serious connections. DOB: 23 BBY",,terrus_starblade.png,Clearly Team Edward,people
Crimson Princess,The slaver ship we commandeered to get to Kessel to rescue Keela. Originally found on Tattooine.,,,,ships
Crixa Adeem,"Culkoo's mother. Former Rodian Law Enforcement Division member, killed by the syndicate as leverage/collateral damage over Torka Vossk's ties with them.",,,,people
Dakao,See Dakoa,,,,people
Dakoa,Bith vendor who sold us our secondary transponder.,,,,people
Darkstalker,"Horrible, dark-side-touched creature we fought on Votaris on the way to claiming the Aeon Codex.",,,,other entities
Darkstar Tree,"A species of tree found on the forest planet Kella and worshipped by the Wellik. The tree has natural connections to the Force of the planet and is consequently highly prized as material for a manner of things, from furniture to lightsaber hilts. The Black Sun group had interests in harvesting these trees via mechanized and slave labor until we (at the behest of Cho) put a stop to it all.","Overview:

The Darkstar Tree, exclusive to Kella, a moon shrouded in dense forests, is a botanical marvel. Known for its imposing stature, striking dark black wood, and reddish-gold leaves that shimmer under Kella's moons, these trees are akin to the mythical titans of folklore, towering over the landscape like ancient guardians.

Sacred Connection:

To the native Wellick, a sentient humanoid deer-like species, the Darkstar Tree holds profound spiritual significance. Interwoven with the Force, these trees are revered as living symbols of Kella's spirit. They form the heart of Wellick culture, serving as sacred sites for communal rituals and tranquil spaces for meditation.

Ecological Role:

The Darkstar Tree plays a pivotal role in maintaining Kella's ecological equilibrium. Its extensive root systems prevent soil erosion and sustain a unique ecosystem, home to several species found nowhere else in the galaxy.

Illegal Exploitation:

Under the oppressive control of the Black Suns Cartel, the Darkstar Tree faces severe threat due to rampant, unregulated exploitation. The Black Suns, driven by greed, have turned Kella into a hub for illegal logging, harvesting the rare Darkstar Wood for the black market. This lucrative trade is a direct violation of New Republic laws, but enforcement is virtually non-existent on Kella, leaving the moon's fate hanging in a precarious balance.

Devastating Impact:

The unchecked harvesting of Darkstar Wood has led to widespread deforestation, disrupting the ecological harmony and endangering the future of both the Darkstar Tree and the native Wellick. As the Cartel continues to strip Kella of its natural resources, the survival of this once-thriving moon hangs in uncertainty.

Cultural Tragedy:

For the Wellick, the destruction of the Darkstar Trees is not just an ecological disaster but a devastating blow to their cultural identity and spiritual beliefs. The desecration of these sacred groves symbolizes the loss of their heritage and a direct attack on their way of life.

Conclusion:

The plight of the Darkstar Tree and Kella serves as a stark reminder of the consequences of unchecked exploitation and the need for galactic awareness and intervention. As the moon's natural beauty and cultural heritage teeter on the brink of extinction, the Darkstar Tree remains a poignant emblem of what is at stake – the preservation of a unique ecosystem and the survival of an ancient culture intimately connected to it.",darkstar_tree.png,Valuable redwoods.,objects
Darro,Navigator's Guild operative who tried to stop Vriska from helping us. His disruptor pistol made a nice present for Culkoo.,,,,people
Dathomirian Phalanx,"Republic research ship where Vic Ren (Jira) formerly served. The last known commander was Vex Antiz, a dathomirian, and was last known to be in the Uknown Regions, in Wild Space.",,,,ships
Dax,Contact given to Culkoo with more information on the Argent Circle scrapper group.,,,,people
Deigo Floto,Jedi guardian of the Tomb of Vexa Chur--whose own tomb was encountered on our way to Vexa Chur's 900 years later.,,,,people
Dennan,Capitol city of Haccara,,,,locations
Devinos 4,Small Imperial ISB listening station one system over from New Orvos,,,,locations
Devion,Top secret research facility and last known location of Beakiya Mota. All we know is that it's similar to Quantham.,,,,locations
Devric,Deveronian who spoke with Khay at some point?,,,,people
Dolla,Female twi'lek who was one of the guardians of the Tomb of Vexa Chur.,,,,people
Dr. Anders,Head botanist of the base where we woke Kandala. Investigated the samples we brought back from Abrinov.,,,,people
Dr. Armatage,See Dr. Armatige,,,,people
Dr. Armatige,One of the two remaining researchers found in the wreckage of the Eclipse in the Anosh system. Was allegedly trying to find a cure for Rakghouls.,,,,people
Dr. Armitage,See Dr. Armatige,,,,people
Dr. Avis Kraan,Deceased doctor who was working on the Eclipse when it crashed. She met her grisly fate by being drained by a Ssi-Ruu.,,,,people
Dr. Edal,Herglic doctor associated with the Eclipse. Found his locker in the crash site.,,,,people
Dr. Elon Revas,"50-ish year old Mirialan scholar, employed by the Koss family. Gave us information on the Order of the Darkstar and the golden holocron in Varokis' possession.",,,,people
Dr. Grimfollows (Grim),Ithorian doctor who helped replace Vi's arm.,,,,people
Dr. Jaxon Kline,Clone tech expert who worked on Cerberus.,,,,people
Dr. Keldan,"Eilin's father and premier expert on ancient Sith lore, language, and history. Unfortunately, he was killed by lightsaber wielders after getting too close to the Aeon Codex--presumably making him an enemy of the Order of the Darkstar.",,,,people
Dr. Nariyah Reyan,Genetic engineer who worked on Cerberus.,,,,people
Dr. Ora,Younger human doctor who replaced Vi's arm after losing it on Haccara. She also gave us information about Rase and a Zeltron working for Endara.,,,,people
Dr. Ota,"One of the living researchers encountered in the wreckage of the Eclipse. She was heavily involved in Rakghoul research and disturbingly protective of them. Coincidentally, she was also a top student of Dr. Starblade's.",,,,people
Dr. Shamish Starblade,"Born on Coruscant, the brilliant geneticist and clone expert began her career by interning at the Grand Republic Medical Facility, which gave her the connections to join a number of projects reporting directly to Emperor Palpatine. Project Cerberus was her venture that attempted to clone the Emperor, Force powers and all, but she secretly diverted at least some resources to clone Khaylia. She successfully achieved this--twice actually!--but was not thrilled with her first success's defection from the Empire.",,khay_mom.png,"Mad scientist, but she did give us our Khay.",people
Dr. Voss Henson,Neurologist who worked on Cerberus.,,,,people
Draken Vossel,"Local weequay warlord on Savara Cross on Zyrakar. Impounded Caeli Tarn's ship The Drift, causing us to liberate it from him in order to get closer to the Order of the Darkstar. Secretly bugged our ship before escaping to Votaris.",,,,people
Drayk,See Admiral Valeria Drayk,,,,people
Dulna the Hutt,Bacta supplier for the New Republic,,,,people
Echani,See Echani Way,,,,concepts
Echani Way,Force tradition emphasizing the continuous nature of the Force. They view the light and dark as the same concept with different aspects and seek to pursue balance and understanding of the entire concept.,,echani_logo.png,Logo of the Echani Order,concepts
Echo Base Sigma,Small Republic base on the moon of Paraga IV. We had a quick stopover here to refuel and resupply after Mirial and before going to Valsura.,,,,locations
Eclipse,"New Republic medical research ship, lost on the edge of Uknown Space near the Anosh system. Notably had Dr. Starblade on board before she was 'lost'.",,,,ships
Eera,See Ira,,,,people
Eha'io,"Presumed guardian or otherwise protector of Leoonia. The girl kept asking for this person, not realizing they were bitten by an insect and were likely killed by a viral bioweapon or some other chemical agent.",,,,people
Eilin Keldan,Daughter of a galaxy-reknowned scholar of ancient Sith civilization. She has a protector droid named Zeke,,eilin.png,Daughter of a Sithin' Man,people
Elara Tarn,"Apprentice to Caelum Rexis, both of whom serve Lord Var in the Order of the Darkstar. She attempted to stop us from acquiring the star map of Force vergeances, but was thrown away from us onto a far-off platform by Kavin. While she escaped with her master emptyhanded, according to her father, she never returned to the Order.",,,,people
Elinara Zhen,"Member of the Jedi Order who wrote a note to Vilira Koss asking to take in her twin children Vi and Var. The note was preserved, unopened, in a book in Vilira's study--implying Vi and Var's future was much discussed among adults during their childhood.",,,,people
Embara Tree,"Ancient Sith tree that produces crystals instead of leaves or fruit. Revered by Kandala, other ancient Sith, and other 'sorcerors', it was known to be capable of at least growing on Dathomir in the known systems. Their seeds were believed to be able to house the spirits of the fallen and provide for their resurrection.",,,,objects
Endara,"Harch, former ISB agent. Lead the operations on Caldara Station in service of the 'Triumvirate'--allegedly 3 Moffs leading the rebirth of the Empire. We captured her using a Harch-specific sedative, but her parting words about Dr. Starblade wanting to see her daughter still gave her the last laugh.",,,,people
Epsilon,"Clandestine Republic intelligence group that originally kept medical records of our former imperials--Khay and Kavin--but grew to expand its interest in all of us even when we were working for them. Originally under Gold Team with Major Kal Juros, we were reassigned to General Barris later.",,,,organizations
Eshani,See Echani Way,,,,concepts
ESO-1,Serum with some sort of mind-altering properties. This particular formulation was used on Trynn for her memory implantations.,,,,objects
Ezor Desh,"Former Sith, they abandoned the Dark Path and teaches combat at the Echani training academy. Currently in a relationship with Thelania Voss.",,,,people
Faldonna,Trandosian woman on Tatooine who dug up information on Crimson Ghost Squadron for us (for 500 credits).,,,,people
Falling Star Mercenary Company,"Mercenary group encountered on Wolak. Mostly comprised of former imperials, they were interested in the Collective during our time on Wolak.",,,,organizations
Farpoint Station,Located on Pranrock III. Was the location of navigation data we needed to ultimately find where the Eclipse crashed--the planet RY-467.,,,,locations
Fish Market,Valsura market where exotic goods can be acquired. Location where Vi bought her Spectra-Fiber Combat Armor.,,valsura_fish_market.png,"The ""Fish Market' on Valsura",locations
Free Navy Zelleck,"Group that stole bacta from Dulna the Hutt, allegedly for Kalgus the Hutt.",,,,organizations
Frenzy,"Freighter operated by the Falling Star Mercenary Company. Captained by Rom. Very likely transported spice, at least according to Kavin's nose.",,,,ships
Freya Sett,Former Imperial commander that controlled the operation that destroyed Cho's home and people. She was killed by Cho while leading the Black Sun operation on Kella.,,,,people
Fuzzmaw,"Cute, cuddly animals found on Bet'su and adopted by Keela. They breed like Kavin does spice.",,fuzzmaw.png,Stop. Fucking.,other entities
