Entry,body,expanded_info,img_path,caption,category
Lieutenant Commander Aeron Starblade,"Youngest son of Jarl and Shamish Starblade, attended the Royal Imperial Academy and joined the Imperial Army and was stationed in Scarif as artillery. Growing up, he was very close with Khay and had a rough and tumble personality--almost reminiscent of her future wife. Of all the Starblade children, he stood out the most, as he was the only one to actually struggle in the Academy. He and Khay fought a lot as kids, which was worsened by the fact the older brothers were at school while the parents were at work. At one point he even walked in on Khay having 'relations' with Treeya, the sister of one of her eldest brother's best friends. DOB: 21 BBY",,aeron_starblade.png,Like Fabio and Anakin had a baby,people
Lieutenant Commander Diallo,One of Kavin's former instructors in the Empire. Was involved in a Remnant plot to disperse a viral bioweapon on Coruscant using weather droids. Ultimately foiled by Kavin's Kavining.,,,,people
Lieutenant Griff Arten,Former Rebellion soldier who served under the same commander as Vi. She knew him as Crazy Arty. Encountered on Bitronia while rescuing a squad of New Republic soldiers.,,,,people
Lieutenant Odona,New recruit in the Republic whose family was formerly Imperial--a fact she hid by slicing into Republic computers and erasing. Kavin tracked this down and used it to blackmail her into helping him sabotage the computer systems on New Orvos to hide his own screw up from before with Jess.,,,,people
Lieutenant Travins,"Scruffy, dark haired, green eyed Republic officer in Abrinov system. Received our report after rescruing Kandala and Khay's receiving 'upgrades'.",,,,people
Liora Tarri,"One of Vi's cousins, very flirtatious with fucking Kavin. She's a bit shadier than your average Tarri/Koss, and helped hook Kavin up with a bit of spice. She met Thrawn once and is attracted to rare and beautiful things, which apparently she thinks Kavin is one?",,,,people
Lira Wessex,Former republic pilot promoted to base commander at Echo Base Sigma. Stressed over protecting the region with such limited resources.,,,,people
Lirrokwa,Wookie friend of Terrick Tan,,,,people
Lisandra,Deligate of House Irizi who met with us before allowing Kavin to meet with his sister.,,,,people
Loram,See Lorem,,,,people
Lord Renlu,Ithorian owner of the Sarlacc Pit Bar and also slaver. Has a close working relationship with the Pykes. We did once say we'd come back and free them…,,,,people
Lorem,"Chauffeur for the Koss family, slightly older than Vi. Was ""one of the good ones"" according to Vi, who had genuine affection for him.",,,,people
Lorna,Information broker operating out (and maybe owner?) of the Scarlet Shadow. She gave us the lead on Nebula's last location at the cannery--for 500 credits. Told us too many people were asking about the Order of the Darkstar. Maybe we should keep an eye on her.,,lorna.png,She's seen some shit.,people
Lumina Station,Former base of the Argent Circle on the Arami System near Hutt space. ,,,,locations
Luminastag,Deer-like bioluminscent creatures that were Force sensitive. Encountered on Krythara.,,,,other entities
Luminoustag,See Luminastag,,,,other entities
Lurraven,"Strange avians encountered on Valsura. While most were wild, some were tamed or somehow otherwise under the control of the Order of the Darkstar and were used to spy on us.",,lurraven.png,Quote the Lurraven: Surprise Motherfucker!,other entities
Madilon,"Mineral mined on Waylosh. It is very elastic while having a high tensile strength--both good properties for hyperdrives. However, the mining was quite toxic. Other properties caused it to often interfere with communications--at least according to Cho.",,,,objects
Major Kaelan Terrik,"High ranking officer serving under Admiral Drayk. They were involved in the faction's operations in the Nihlus Veil and on Votaris, attempting to retrieve the Aeon Codex for themselves.",,,,people
Major Kal Juros,Our former commanding officer during our time with Epsilon proper before we were transferred to General Barris. Associated with Gold Team.,,,,people
Major Quintura,"Leader of Task Force 151, responsible for capturing fugitives from the Republic--which at the time we were because of the Pykes enslaving our child. Was also Doc's commanding officer for the time.",,,,people
Makashi,"Form II, also known as Makashi, The Way of the Ysalamiri, or The Contention Form, was the second of the seven classic forms of lightsaber combat. Makashi was the most dueling-centric of the seven classical forms. Form II allowed an initiate to defend themselves against an opponent with minimal effort, while placing a heavy focus on avoiding disarmament.",,,,concepts
Makken (Mac),"Older, strong Klatoonian who accompanied us on our training journey for the Echani. Could not hear the crystals on his first attempt, this was his second.",,,,people
Marsar,Mineral used for droids. Mined on Cinta.,,,,objects
Master Aldin,Jedi who was the leader in the Tomb of Vexa Chur. He was killed by his padawan and daughter Ira when she betrayed him and his followers. His presence lived on in a golem that protected the Tomb from further interlopers--until we destroyed it and freed him in the process. He helped us to craft our lightsabers and allowed us to use the remaining supplies in the Tomb before asking us to bury it and never let anyone discover it again.,,,,people
Master Ferren,"Jedi master in the Tomb of Vexa Chur, was the owner of K-7.",,,,people
Master Liora Vayal,"Force ghost in the sacred grove on the Tholothian Crest. A former guardian of the Jedi Order, she eventually became the guardian of the grove and guided us in creation of (some of our second) our lightsabers.",,,,people
Master Tarik,Custodian of the Jedi Temple who escaped Order 66. He was sought out by many as a sage and by at least one person as a blood donor--Dr. Starblade. His blood was used to make clones with a strong connection to the Force--one of which includes Khay (against her will!) and likely the clone of Palpatine we fought on Bet'su.,,,,people
Mekren,Culkoo's human partner during her pit fight on Haccara in front of Endara.,,,,people
Merken,See Mekren,,,,people
Merrick Tosch,"Charismatic political candidate representing Imperial interests on Haccara. His talking points included working with the UPA and rebuilding a better Haccara. He disagreed with Endara about the use of power, though, so maybe he wasn't all bad? Furthermore, his ideas were oddly inclusive for an imperial and drew crowds of non-human supporters. Instigators tried and failed to assassinate him, including one using a Huttese shard rifle.",,,,people
Mira Kast,Mandalorian granddaughter of Rook Kast. She sports purple hair and wears her mother's armor--nor was she intimidated by Vi's saber. Possible leader or high ranking member of the Shadow Collective.,,,,people
Mistress Aria,Contact in the Nax'ari Syndicate. Used Culkoo's niece Talia as a bargaining chip.,,,,people
Moloco,Shady arms and drug dealer on Tatooine.,,,,people
Morga,Sith Inquisitor who was a companion to Endara.,,,,people
Morven Rask,"Force master of the Echani tradition. Tried to claim the Aeon Codex for himself to fight the Krynn, but instead offered to train Khay and her crew in his ways with the hope they would join his cause.",,morven_rask.png,"Initially sus, he's cool now.",people
N.R.S. Phoenix,New Republic ship we were brought to by Doc after our transgressions against the Republic while trying to get the kids back.,,,,ships
Nala Se,Kaminoan cloning expert recruited by Dr. Starblade to help in Project Khaybear. She may be the only one responsible for Khay's breaking free of Dr. Starblade's attempt to implant Imperial conditioning into Khay's genome.,,,,people
Nali Darkstar,"TIE pilot whose helmet stayed on Endor's moon long after the battle where Vi and Khay met. Years later during a romantic getaway, they found the helmet while wandering through the forest for a picnic.",,,,people
Nax'ari Syndicate,"Shady syndicate that controlled aspects of Rodian politics. Crixa Ageem was investigating them while her brother, Torka Vosk, worked with them--a connection that ultimately got Crixa killed. Not wanting or being able to completely rock the boat on her homeworld, Culkoo left the syndicate at status quo.",,,,organizations
Nebula,"Tall, Deveronian male who was an operative/informant for the Echani Order. Disappeared during his inquiry. We found him imprisoned on the foggy island in Tidehaven on Valsura while pursuing Var. As he was not a true member of the Echani, we set him free and let him go, as his job was done.",,nebula_deveronian.png,,people
New Orvos,"Outer Rim planet that served as an early hub of operations as we were starting out in our campaign. Some unfortunate misunderstandings on the nature of Project Hydra, Jess's security access, and Kavin's (allegedly) expert slicing caused a major security breach that ultimately lead to the downscaling of operations on the planet. It was a major blow to the Republic in the sector, but we got the info we needed, right?","Sector: Outer Rim Territories

Region: Just outside Hutt Space

Planet Type: Terrestrial

Climate: Temperate

Terrain: Diverse; primarily agricultural with mountain ranges, valleys, and forested hills
Key Cities: Orvos Prime (Capital and Main Metropolitan Center), Tarrin (Secondary City and Black Market Hub)

Government: New Republic Governance with Local Elected Officials

Population: Mixed; predominantly Human with a significant representation of Twi'leks, Rodians, and other Outer Rim species

Economy: Agriculture-driven with contributions from trade, technology, and black market dealings

Exports: Agricultural produce, textiles, technology parts

Imports: Machinery, luxury goods, spices

Allegiance: New Republic

New Republic Base: Fortitude Outpost (Strategically located within proximity to Orvos Prime for logistic support and rapid deployment)

Black Market Influence: While the New Republic maintains official governance, the proximity to Hutt space has allowed for a thriving black market, primarily run through Tarrin. Smugglers, bounty hunters, and traders frequent the city, dealing in everything from rare artifacts to embargoed goods.

Description: 

New Orvos is a beacon of New Republic ideals in the Outer Rim. It's lush and fertile lands are dotted with vast stretches of farmland that feed not only its population but also contribute to the food supply in the region. However, the planet's serene exterior belies the bustling activity of its metropolitan centers.

Orvos Prime, the capital city, is a hub of political activity and houses the main base of New Republic operations on the planet. It is characterized by its orderly city planning, well-maintained public facilities, and the presence of New Republic troops that ensure the safety and upholding of the law.

Tarrin, on the other hand, is the polar opposite. Nestled among the mountain ranges, it is the unofficial capital of the planet's black market. It’s a city where credits speak louder than allegiances, and where the New Republic's influence is challenged by the shadowy underworld powers that profit from the proximity to Hutt-controlled territories.

New Orvos's location makes it a strategic asset to the New Republic, providing a foothold near Hutt space from which to extend their influence into the Outer Rim. The presence of the New Republic military base, Fortitude Outpost, underscores the planet's importance. The base is a center for reconnaissance missions, a deterrent against Hutt incursions, and a refuge for those fleeing the lawlessness of the Outer Rim.

Despite the undercurrents of illicit dealings, New Orvos is a planet of opportunity. It's a place where one can witness the juxtaposition of the New Republic's ideals against the practical realities of Outer Rim living, where the untamed spirit of the frontier meets the order and organization of the New Republic's vision for the future.",new_orvos.png,New Orvos from orbit.,planets and regions
Nightshade Marauder,"Large, repurposed Imperial Frigate under the control of the Dusk Haven Militia. Its large gravity well generators blocked us from immediately jumping to hyperspace after recapturing The Drift. With a coordinated assault between The Drift and the Bucket, both ships were able to successfully evade the larger foe--but the Bucket may have brought an unexpected tracker beacon friend with them after escaping.",,,,ships
Nihlus Veil,Extremely difficult patch of space with little life--but still with some planets lost to time.,,,,planets and regions
Okchota (Cho),"Iakaru spy, scout, operative, whatever else you really need--Cho can probably do it. After having his people slaughtered and enslaved by the Empire, he dedicated his life to fighting against them and freeing those who were oppressed--wanting to make sure he can spare as many others as possible the fate he and his people were subjected to. After taking personal revenge against Freya, the one who originally led the attack on his home, he found the Force later in life and became an Ataru Striker to capitalize on his extreme agility. He now seeks to protect the galaxy from threats within and without.",,,,people
Okkipo Gran,"Deveronian melee fighter involved with the Twin Suns on Waylosh. He was happy to fight Vi, but circumstances and other bullshit made him kinda win, which is bullshit. He wanted a rematch, and so does Vi--we'll see.",,,,people
Omega Nine,Rich area of the space port on Mirial in Vi's home city.,,,,locations
On The Ropes,Fake Iakaru holiday that Cho made up to troll Varokis.,,,,concepts
Onda Por,Our Republic contact on Bitronia.,,,,people
Ooma,"Victim of Imperial experiments encountered on Treduru. She wore intricate tattoos to cover the scars she accrued while being tortured and experimented on. She gave us the lead to Quatham, and was the only one to escape that place alive. She offered to help Khay--the implication of which we did not grasp at the time.",,,,people
Operation Phoenix,"Project headed by Dr. Starblade during her brief stint with the New Republic. It sought to find a way to extend the life of clone troopers from the Clone Wars, but ultimately was deemed not worth pursuing. Doc was one of the few ""successful"" subjects.",,,,organizations
Operation Waking Shadow,"Plot to assassinate Senator Wren Mikkel which involved Crimson Ghost squad. Vereck Kren, a local gang member, attempted to use a bomb to kill the Senator but was foiled by someone. We investigated the aftermath.",,,,organizations
Order of the Darkstar,"Secret cabal of Force sensitives, powerful in the Dark Side and opposed to the Krynn, who use their own lightsabers crafted from the Darkstar itself--but is it corrupting them to work for the Krynn unwittingly? The Order is lead by Varkas Koss (Var)--Vi's twin brother long thought to be dead.",,darkstar_logo.png,Logo of the Order of the Darkstar,organizations
Orin Zhar,Political opponent to Torka Vosk who died mysteriously--to Vosk's advantage--during a campaign for mayor of the Rodian city of Iskaayuma.,,,,people
Orm,"Son of King Haldor of Ulara and pro-Republic. When shit hit the fan on Ulara with his sister Kreda's coup, we extracted him with great effort safely to the Republic.",,,,people
Outbound Flight Project,"Outbound Flight was an expeditionary project, led mainly by Jedi Master Jorus C'baoth, that sent a mission of six Jedi Masters, twelve Jedi Knights, and 50,000 men, women, and children beyond the borders of the Galactic Republic into the Unknown Regions where they hoped to pierce the edge of the galaxy and seek out extragalactic life.",,,,organizations
Outbound Reclamation Initiative (ORI),"Desperate attempt by the Rebellion, after the massive defeat at Hoth, to find the site of the Outbount Flight Project disaster and reclaim assets, information, or anything deemed useful. Was silently also an attempt to find Force artifacts and/or users that could help the rebels in the fight against the Empire. Its top secret nature was its ultimate demise, as the leaders of the project were forced to abandon it after results were not as quick as needed and newer intelligence implicated the second Death Star project as the immediate target for all rebel resources. Varkas Koss was one of the members of ORI believed to have been dead after it was abandoned with no clear survivors.",,,,organizations
Ozy,"Twi'lek woman who helped us gain an audient with Kalgus the Hutt, which we wanted to use as cover to recover the stolen bacta for the Republic.",,,,people
Paraga IV,Moon where Echo Base Sigma is located.,,,,planets and regions
Pesha,Goddess of the dark worshipped on Ulara.,,,,other entities
Petro,Friend of Cali and Zatt who was killed by the former. Zatt has his name tattooed on him.,,,,people
Phinarii,"Aquatic natives of Valsura. Their bioluminescent colors on their heads are the subject of much speculation by other races--either beautiful or used for hypnosis. Oddly, they read as voids in the Force--which is extremely unsettling to us.",,phinarii.png,Typical Phinarii,people
Phrikrite,Material with properties similar to beskar. Primary component of Vi's Spectre-fiber Combat Armor.,,,,objects
PIMC Station 3 ECHO,Mining platform we used to access the caves with the korthium kyber crystals on Alastea.,,,,locations
Pranrock III,Remote planet near an unkown and chaotic region of space. A small Republic embassy was maintined there.,,,,planets and regions
Progressive Coalition,Political faction in the Republic Senate that generally worked toward more independence and a weakening of the Republic. Often had clandestine support from Imperial Remnant factions and was supported by Senator Kall.,,,,organizations
Project Khaybear,"Secret project lead by Dr. Starblade to clone the daughter she lost, Khaylia. Using resources from Cerberus, she worked to clone Khay perfectly, down to her memories. While successful, she had to recruit the help Nala Se, a Kaminoan. Nala Se ultimately betrayed Dr. Starblade's trust and made modifications to Khaylia's genome allowing her to break free of the Imperial conditioning Dr. Starblade was implanting.",,,,organizations
Pytock Industrial Mining Corporation (PIMC),Company mining korothite crystals on Alastea.,,,,organizations
Qirg Yinton,Faction unaffiliated Quarren political candidate on Haccara. Wanted to build a space port to boost the economy.,,,,people
Q'ren,"Echani member who taught Foresee and Farsight. As a Chiss, he was a member of the Ascendency until a not-to-be-discussed event forced him out.",,,,people
Quantham,"Abandoned Imperial research station. This aquatic station had a surface and subaquatic levels that required different gear to access. Ooma was tortured here, among a host of other Force sensitives, as part of some twisted research. In the sector, there was also a bounty out for Dr. Starblade. Once upon a time, little Khay spent time there during her childhood.",,,,locations
R3 (Artie),Black astromech droid originally belonging to former ISB agent codenamed Lambda.,,,,droids
Rak Chask,Former Alliance deveronian captain who is now running the Wraiths. Chask is very charismatic and loved by his people.,,,,people
Rakka,Female Zygerian slaver who liked to beat slaves with her energy whip. Effortlessly bisected by Vi.,,,,people
Ranara,"Young, dark-haired human who is a visionary at the Echani training facility.",,,,people
Rase Iren,Former ISB agent and Endara's second-in-command on Haccara.,,,,people
Raven Tak,Male Rodian who gave us information to take aboard the Olympus.,,,,people
Raxul,Large aquatic monsters we fought with in the waters of Quantham. They did not like light--ergo our flares.,,,,other entities
Red Hand,Street gang on Coruscant with Imperial loyalist leanings. The Starfall Cantina was one of their main hangout spots.,,,,organizations
Rhodium,Exotic material from the Unknown Regions that became reactive when put under pressure. Verreck Kren used this material in his bomb that he tried to use to assassinate Senator Mikkel.,,,,objects
Rhyssa,Togruda student at the Echani training facility.,,,,people
Ris,Human soldier in Crimson Ghost Squad.,,ris.png,Human fighter.,people
Ritual of Kaggath,"Ritualistic combat purportedly used by the Order of the Darkstar to challenge someone for the right to lead the Order. Only certain members of the cult can issue this challenge, as one must have a rightful claim to issue it; however, the challenger can still nominate anyone to be their champion. This situation is what happened to us, as Vi was named the champion for Jaxsen Tarn in order to stop Var's ambitions for power. As they fought in the Ruins of Atramentar, she could have succeeded, but her desire to save her brother caused her to use caution and restrain to make sure to keep her brother alive. We await the response of the rest of the audience to this...violation.",,atramentar_ruins.png,,concepts
Rockhopper,"Species of adorable, rodent-like animals encountered around the time we went to Kiru looking for stolen bacta. Resembling kangaroo rats, they bred like rabbits though--infesting the Bucket until they were likely ousted by better infestors called the Fuzzmaws. At least they tasted good to Cho.",,rockhopper.png,Try it with peanut oil!,other entities
Rom,Duros captain of the Frenzy,,,,people
Rook,"Wookie companion and adopted sibling of Keela's. Somehow finding his way to Ryloth, he was raised with Keela as a member of her family until the fateful attack by Thrax that caused both of them to flee. He was believed dead after the event, but somehow found his and Keela's way to Bitronia, where they met the crew, who quickly fell in love with them. Khay and Vi consider him their son and will vehemetly fight to defend them from any harm that they can. He and Keela were both captured on New Endor while looking for their own ship, which turned out to be the start of a trap the Pykes were setting for his adopted parents. Also prodigiously curated a fine collection of wookie pornography. ",,,,people
Ruins of Atramentar,"Sacred site in an ancient Sith temple, currently used by the Order of the Darkstar to presumably conduct business and/or rituals important to their cult. They were the site of Vi and Var's fateful duel to the 'death', the Ritual of Kaggath, but Vi's goal of saving her brother from himself meant she needed a little help from her friends--who blew the ruins up in the way only Cho and Kavin can. At least they're still ruins?",,"atramentar_ruins.png,atramentar_ruins_after.png",The Ruins of Atramentar on a mysterious island in Tidehaven on the planet Valsura.{}Kavin + Cho = The more ruined Ruins of Atramentar.,locations
Rusty Blaster,Bar on Tatooine.,,,,locations
RY-467,Planet in the Anosh system where the Eclipse was known to have crashed.,,,,planets and regions
Saren Tarri,Older sister (mid 20s) to Liora and cousin to Vi.,,,,people
Savara Cross,"City on Zyrakar. Under control of the Dusk Haven Militia, it was a hotspot for those wanting to lay low from the Republic. It is the heart of the planet, which is itself large crossroads for galactic trade.",,,,locations
Savek,Name found on the ID of a dead Chiss whose armor was taken by Culkoo and Kavin. Not likely this was the actual name of the person.,,,,people
Sayto,Wellik leader who initially distrusted us but relented when Mother Ukada vouched for us based on our connection to the Force.,,,,people
Scarlet Shadow,"Seedy and scary bar known to not only be a hideout for local bad guys, but also a known hub for Order of the Darkstar activity. Jorin was not pleased about going here.",,,,locations
Scavenger's Den,"A mix of ramshackle buildings, discarded machinery, and tons of drugs. Was the location of Nebula's tracking beacon, which we found in his jacket after sneaking it away from some lower-ranking Void Claws. Jorin stayed at the Fish Market for this excursion.",,,,locations
Selorin,"Muun contact of Caeli's. He was a finder for the Order of the Darkstar, which is why Caeli sold her Forcey things to him.",,,,people
Senator Brin Aldir,Renegade senator who stole a holocron from an archive on Correllia--turns out his family was being threatened. We saved him from Amata when she was threatening him.,,,,people
Senator Kall,Corellian senator who was pretty racist. Stood to benefit from the assassination of Senator Wren Mikkel had the attempt been successful. Leader of the opposition party.,,,,people
Senator Khalifa,"Senator who opposed Senator Leia, advocating that the Remnant was just rumors and there was no need to increase military spending and power.",,,,people
Senator Malos Adresh,"Senator involved in the government of Bitronia. Was our primary target to ""rescue"" for the New Republic--his fate is unkown, but we did not feel good about leaving him to the Republic's mercy.",,,,people
Senator Telran Adresh,"Brother of Malos Adresh and Senator to the Republic for his planet. He was far more pro-Republic than the demographics of his planet would imply, but maybe he was a little distant from them all the way on Coruscant? We contacted him out of concern for his brother, but he did not seem too worried. We did everything we could?",,,,people
Senator Wren Mikkel,"Victim of a, fortunately, unsuccessful assassination plot involving Crimson Ghost Squad and Verreck Kren. Represented Tarus 4 and was a member of the Unity Party, which favored strong relationships between citizens and governments and was in favor of staying with the New Republic.",,,,people
Senior Technician Orto,Kavin's fake name when he was infiltrating the main computer systems on New Orvos.,,,,people
Seraphara,Force Aspect of Light we encountered in the cave on the Tholothian Crest.,,,,other entities
Sergeant Farrik,Officer in charge of engineering on the Eclipse.,,,,people
Sevick,See Sevix Confederation,,,,organizations
