Entry,body,expanded_info,img_path,caption,category
G2P0,"Colorful custodian droid with a boom box in his chassis. Found on Bet'su, he was the facility gardener and grew several varieties of plants. After our escape, he came with us and became the ship's gardener, taking over Doc and Culkoo's old spaces to grow a bunch of different plants for us, including some plants from Ryloth for Keela and psychedelics for Kavin.",,,,droids
Garris,Chadrafan thief who was the leader of the group who actually stole the bacta from Dulna the Hutt.,,,,people
General Brix,Republic general encountered during the spice heist on Cinta.,,,,people
General Fache,"Officer who met us on Endor City, member of Epsilon.",,,,people
General Kaelen Renfro,Officer in charge of oversight of Project Cerberus.,,,,people
General Krix Barriss,"Current commanding officer, though he's mostly cut us loose for now--we work better without rules. We were originally suspicious of him, and Doc was able to let us know he commanded a squad known as the Reapers during the rebellion. However, since our first meeting we've mostly come to trust him--especially since he helps shield us from Kiara.",,general_barriss.png,Not to be confused with Barriss Offee,people
General Seretti,Republic officer around Endor.,,,,people
Gern,Name asked for by a gangster on the other end of a comm acquired from a defeated gangster on Jira's farm on Haccara.,,,,people
Glizzo the Hutt,"Hutt crimelord on Nar Shadda who received our 'reallocated' shipment of bacta on the Stormpike. Afterward, the video of the meeting was either stolen, given, or hacked and ended up in the hands of the Republic--which didn't make us look good.",,,,people
Gorg,"Herglic runner of the Halcyon club, where we were suggested to find a navigator to help us locate the Eclipse.",,,,people
Grand Admiral Rae Sloane,Human woman in command of the ISD Leviathan and the 3rd Imperial Fleet. Her legion wears a shark logo with the number 3 on their armor with a dark grey and crimson trim palette.,,sloane.jpg,,people
Grand Admiral Thrawn (Mitth'raw'nuruodo),"Chiss Grand Admiral of the Empire, in direct command of his flagship--the ISD Chimaera, and the 7th Imperial Fleet. A brilliant commander, leader, and tactician, he appears to be trying to establish the New Order--a masquerade for what is essentially his version of the Empire. As transparent as it seems to us, he has managed to convince several parties that were previously opposed to the old Empire that the New Republic is weak or otherwise worse than swearing allegiance to his New Order. Two of these parties include The Order of the Darkstar, as lead by Var Koss--Vi's estranged and thought-dead brother, and portions of the Mirialan noble elite, including Vi's parents, Varokis and Vilira Koss. He is also employing the services of House Iriza of the Chiss Ascendancy to supply his fleets with new, superior ships and armor--which coincidentally is also the house of Kavin's long-lost, Force-sensitive sister Ziivala. The cherry on top, of course, is that Khay's mother's clone projects have always been intimately involved with Thrawn's ambitions, so we are only waiting to find out who, if not all, of the Starblade family is working with this central figure opposing us. Or perhaps he's the only one capable of uniting enough parties to stop the Krynn?",,thrawn.png,,people
Grick,Trandoshian mechanic who got into a pissing contest with Kavin over the Bucket after the fallout of Ylara.,,,,people
Hacarra,See Haccara,,,,planets and regions
Haccara,"Agricultural planet that imports a lot of heavy machinery. Far off any space lanes, the Remnant still found a foothold on it and began a proxy struggle. Operated under the UPA. Last known location with neutral Pykes before Kavin made us big time enemies of them.",,,,planets and regions
Haleoda,Former imperial resort planet with one large city on a beautiful ocean. Was the site of the launch of the Olympus and where we boarded it.,,,,planets and regions
Haralla,Tropical planet allegedly housing kyber crystals. The planet also may be heavily connected to the Dark Side and had lots of hostile creatures. We opted for the colder and likely less evil Alastea.,,,,planets and regions
Haro,Humanoid and trusted advisor to Endara. Dressed in red armor.,,,,people
Heccara,See Haccara,,,,planets and regions
Heirloom Tea Set,An heirloom to Khay from her mother--originally a gift from Grand Admiral Thrawn himself. She often drank with this set during her short breaks trying to 'resurrect' her daughter.,,,,objects
Heline,"Bartender of the Sarlacc Pit (the bar, not the actual pit) on Tatooine, employed by Lord Renlu.",,,,people
High Priest Buk Koru,"Former experiment of Dr. Starblade, encountered on Quantham. Also infiltrated the church in Ulara City. Was also an advisor to King Haldor's daughter Kreda.",,,,people
High Priestess Dola Dollos,"Priest of Almira, the goddess of light, on Ulara.",,,,people
House Dasklo,House whose crest was originally on Culkoo and Kavin's repurposed Chiss armor. Operatives wearing this armor were involved in the failed kidnapping of Leoonia.,,,,organizations
Ilsan,Zabrak student at the Echani training facility.,,,,people
Inspector Atrus,Security investigator sent to New Orvos to evaluate the breach caused by Kavin when looking for information on Project Hydra.,,,,people
Ira,Fallen jedi who was the former padawan of Master Aldin and secretly his daughter as well. She ultimately killed him during her betrayal and slaughter of those inhabiting the Tomb of Vexa Chur.,,,,people
Irisi,See Irizi,,,,organizations
Irizi,"One of the Nine--major Chiss families that command immense power. House Irizi is currently maintaining a massive enclave on Mirial where they manufacture ships and armor for the highest bidder--which is currently the New Order of imperial remnants under Thrawn. However, not all members of the family are thrilled with this alliance--Kavin's sister included. We managed to sneak a tracking beacon onto one of their ships that successfully located its destination for General Barris and the Republic.",,,,organizations
ISD Chimaera,Apparently new or experimental Imperial Star Destroyer under the command of Grand Admiral Thrawn. Troopers and officers from this feared vessel typically display dark grey colors with blue trimming. The Chimaera is currently in the Outer Rim.,,,,ships
ISD Fury,Imperial corvette flying with the ISD Stormbringer that pursued us to Votaris but had to pull back due to damage from the chaotic region.,,,,ships
ISD Invictus,Imperial patrol frigate that pursued us on our first mission as a team.,,,,ships
ISD Leviathan,Star Destroyer under the command of Grand Admiral Sloane. Troopers and officers from this feared vessel typically display dark grey colors with blue trim.,,,,ships
ISD Predator,Ship under the command of Captain Jarl Starblade during the Galactic Civil War.,,,,ships
ISD Stormbringer,Imperial frigate that pursued us to Votaris but had to pull back due to damage from the chaotic region.,,,,ships
ISD Tarkin,"Imperial Frigate that received the new, powerful ships created by House Irizi on Mirial. It received the one fighter that we bugged before it jumped to hyperspace.",,,,ships
ISD Vengeance,"Flagship of Admiral Valeria Drayk and the former 12th Fleet, now the Shadow's Hand.",,,,ships
Isiele Braden,Zeltron singer/diva that was the talk of the voyage for the Olympus.,,,,people
Iskaayuma,"City on Rodia, akin to real life Chicago.",,,,locations
Jaeger Squadron,"Elite squadron of Republic fighters, commanded by Khay's ex Asha. (Jaeger means hunter in German)",,,,organizations
Jagar Squadron,See Jaeger Squadron,,,,organizations
Jäger Squadron,See Jaeger Squadron,,,,organizations
Jakra,Khoren scout on Abrinov.,,,,people
Jaxima,Crixa Ageem's former superior in Rodian law enforcement. She died in a speeder 'accident' three days after the Siren's Call went missing.,,,,people
Jaxsen Tarn,"Machiavellian member of the Order of the Darkstar who believes in a more traditional Order--one that still dedicates themselves to stopping the Krynn and not acquiring vast amounts of personal power. He disapproves of Var's leadership, as he thinks the Mirialan pollutes the Order's purity by cooperating with outside elements, including Grand Admiral Thrawn's 7th Fleet. These views eventually led him to be dubbed a traitor and imprisoned next to Nebula. When we rescued him, he nominated Vi as his champion in the Ritual of Kaggath, which he had the right to invoke, in order to depose Var's claim on leadership of the enigmatic cult. He did this despite our informing him that we encountered and fought his daughter, Elara Tarn, who apparently never returned from her mission to claim the vergeance star map. When it became clear Vi was going to break the Ritual of Kaggath's rules and accept interference and refuse to kill her opponent, he appeared to still want to work with us on at least escaping the potential wrath of the mad cult.",,jaxsen_tarn.png,"Sorry we fucked over your daughter, it was in self defense.",people
Jedha,"Jedha, also known as the Pilgrim Moon, or as the Cold Moon, or the Kyber Heart, and formerly known as NiJedha, was a small desert moon which orbited the planet NaJedha. Located in the Jedha system of the galaxy's Mid Rim, the moon had a cold climate due to its lasting winter. The historical and spiritual significance of Jedha led the moon to become a world of worship for those who believed in the Force, and a holy site for pilgrims who sought spiritual guidance. Was the location of the Tomb of Vexa Chur, where we discovered a holocron that aided us in our missions and understanding of the Force. The trials of which still haunt us to this day--including the revelation of a Koss family lightsaber.",,,,planets and regions
Jedi,"Order of stuffy, nerdy, and hypocritical Force users who were upended by their own arrogance. A group of which we are decidedly not a part.",,,,organizations
Jek,Tech at a workshop that we traded with for the reinforced shield generator on the bucket.,,,,people
Jenna Terrantea,"Human female acolyte in the Order of the Dark Star. She was killed by Vi in the failed assassination of a Senator on Coruscant, with her Zabrak master only getting away with one of her lightsabers. Using psychometry on the other one, Khay discovered Var was the leader of the Order of the Dark Star and had her first visions of the Krynn before even knowing what they were.",,,,people
Jess,"Human Republic tech originally stationed on New Orvos. She had a short, dating relationship with Kavin that ended amgiguously (a chance?). Kavin used her credential to access the New Orvos secure servers to get us more information on Project Hydra. He got what he wanted, but the breach was easily discoverable. In order to cover his tracks, he later went back and sabotaged the servers too well--the chaos that resulted from this act eventually led to the downscaling of operations on New Orvos and led to Jess being restationed. 

She later contacted us after our time with the Echani to give us a new lead on the Order of the Darkstar--the planet Zyrakar.",,,,people
Jofa,Quarren on Caldara Station who was a contact for Culkoo.,,,,people
Jorin,"Dark-haired human male on Valsura who offered to be our guide for 50 credits (underestimated our funds based on his assessment of the Bucket). He happily guided us to the Fish Market for Vi's armor, but more and more reluctantly he guided us to the shady and seedy parts of town while we looked for trouble aka Var.",,jorin.png,"A handsome younger man with a quick, easy smile.",people
Joris,"Local mechanic outside the Sarlacc Pit bar on Tatooine, chatted with Culkoo.",,,,people
Jorus,See Major Kal Juros,,,,people
Jrick,"""The Rodian,"" an extremely talented and ruthless bounty hunter known to Culkoo. He joined the Twin Suns splinter group.",,,,people
Jurus,See Major Kal Juros,,,,people
Juyo,"Form VII, also known as Juyo in High Galactic, the Way of the Vornskr, or the Ferocity Form, was the seventh of seven forms recognized as canon for lightsaber combat by the last Jedi Council of the Old Jedi Order. In use, millennia before the Battle of Yavin, the Juyo incarnation of Form VII was described as the most vicious form of lightsaber combat and was said to involve a significant internal focus on the part of the user.",,,,concepts
Jyn,Female scavenger encountered at Quantham.,,,,people
Jyrost,"Remote, cold planet and last known location of Dr. Keldan before his assassination. Where we found Eilin.",,,,planets and regions
Kaderyn River,"Large river on the Tholothian Crest. Approximately 20-30 meters wide at the narrowest point, we had to cross it during our quest for new crystals and enlightenment.",,,,locations
Kalgus the Hutt,Hutt who runs a shipyard on Kiru who also stole some bacta from the Republic. We got it back with weird challenges and being awesome.,,,,people
Kandala,"One of the last Sith purebloods still around. She began teaching others after we 'revived' her from a crystal seed of, coincidentally, one of the last Embara trees. Her existence is a heavily guarded Republic secret as of now, but her influence is far--as she 'upgrades' she gave us after discovering her and an associated holocron were the sparks for our initial Force journey.",,,,people
Kandella,See Kandala,,,,people
Kara Adun,See Kara Adune,,,,people
Kara Adune,"Presumably a powerful Force user, with certainly mysterious history. The tomb of which was a primary attraction on the Olympus. May have been released or somehow tampered with during the disaster aboard the luxury liner. Originally found on Dathomir, it was protected by ghosts of Dathomiri Force users--probably Nightsisters.",,,,people
Karrik,Republic Twi'lek ambassador to Farpoint Station on Pranrock III. He gave us information about the area and advised us to find a Navigator at the Halcyon Club. Also he hugged us?,,,,people
Karris Collective,Cartel running Voss Prime,,,,organizations
Karthi (KG438),"Planet in the Unknown Regions where a new threat from beyond our galaxy is alleged to be emerging. Likely in the Anosh system, powers in the surrounding sectors were very concerned about this new faction.",,,,planets and regions
Kattada,Planet near the remains of Alderaan. The former Imperial resort city Haleoda is the site of the Olympus' fateful voyage.,,,,planets and regions
Kavin (Thrak'avi'naktomi),"Technician, mechanic, outlaw, nipple boy--he goes by many names.",,kavin.png,Himbo Chissins,people
Kazzan,Proprietor of the Blue Water on Haccara. Gave us a guy a who would know where to find a shard rifle and vaporators.,,,,people
Keela,"Nine year old, spunky, mouthy Twi'lek girl originally met on Bitronia. Since rescuing her and Rook, they wormed their way into our hearts, and Khay and Vi eventually adopted them. Keela was a technical prodigy--repairing almost all on her own the ship we used to escape Bitronia. She was originally from Ryloth, but her family's farm was forcefully taken over by local bully Thrax over a water rights dispute. She left her brother Torin in Thrax's care out of fear the separation would traumatize him--even though Thrax is the one responsible for her family's pain. She and Rook also were lured to a shipyard on New Endor where they were captured by the Pykes and used as leverage against us. While we got Rook back with a simple heist on Cinta, Keela was sold into slavery on Kessel after our 'failure' to die during the mission on the Olympus. As a member of our family, we moved the fucking galaxy to rescue her from Kessel, though we weren't able to get there before she lost her arm in the chaos, which is one of Vi's greatest regrets. Currently, she and Rook are with the Echani Order on the Tholothian Crest--left there to hopefully keep them safe while we pursue the Order of the Darkstar.",,,,people
Keela To,"Extremely talkative yet talented Twi'lek medic, who served in the rebellion with Vi and dated her for a while. She was the last serious girlfriend Vi had before meeting Khay. Her fate after the rebellion is uknown, but she was discreetly Force sensitive.",,,,people
Kel,Orm's second in command. Encountered on Ulara.,,,,people
Kelden,See Dr. Keldan or Eilin Keldan,,,,people
Kella,"Beautiful but obscure forest world. While it used to be home to lush forests filled with Darkstar trees, recent logging operations led by Freya Sett of Black Suns mercenary group have been using the local Welliks as a slave labor force to harvest and destroy their beautiful yet lucrative home. Having a personal vendetta against Freya, Cho led us to liberate the slaves and personally killed Freya, but the cost of such a crusade took the largest toll on Khay, who shot down a luxury liner hoping to aid the effort. Even accordin gto Mother Ukada it was the right thing to do, but Khay will always have her conflicted doubts about the matter.","Overview:

Kella, a lush and vibrant moon, is home to the Wellick, a sentient species of deer-like humanoids. This serene moon is renowned for its dense, mystical forests, teeming with diverse flora and fauna. The most notable are the Darkstar Trees, known for their spiritual significance and connection to the Force, as well as their valuable dark hardwood.

Current Crisis:

The Black Sun Cartel, exploiting Kella's resources, has initiated large-scale harvesting operations, primarily targeting the Darkstar Trees. This rampant deforestation is not just a commercial venture; it's a systematic destruction of the moon's ecosystem. The environmental impact is catastrophic, with widespread devastation affecting not only the forests but also the native wildlife and the Wellick communities.

Impact on the Environment and Inhabitants:

The relentless harvesting has led to a drastic change in the landscape, with once-thriving forests turning into barren wastelands. The destruction of the Darkstar Trees disrupts the natural balance, endangering numerous species and destabilizing the ecosystem. The Wellick, whose culture and way of life are intricately tied to the forests, face an existential crisis. Their sacred connection to the Darkstar Trees and the land is being severed, leading to cultural erosion and a loss of identity.

Key Figures in the Operation:

- Cell Leader Freya Sett: A former Imperial officer, now a high-ranking member of the Black Sun Cartel. Known for her ruthless approach, Freya Sett oversees the exploitation of Darkstar Wood, showing little regard for the indigenous population or the environmental impact. Her harsh methods and disregard for the Wellick's cultural values have intensified the conflict on Kella.

- Jerex Croft: The head of operations on Kella Station, Jerex Croft is responsible for the day-to-day management of the harvesting. He resents Freya Sett's oversight, viewing her as an outsider who complicates his operations. His contempt for her methods and her background as a former Imperial adds tension within the ranks of the operation.

Resistance and Hope:

In the face of this overwhelming adversity, the Wellick, along with sympathetic factions, have started to organize resistance efforts. Covert operations to sabotage the harvesting machinery and rescue enslaved Wellick are becoming more frequent. The situation on Kella is dire, but the resolve of its inhabitants to protect their home offers a glimmer of hope in these dark times.

Conclusion:

The struggle for Kella is not just a local issue but a poignant example of the larger conflicts that plague the galaxy. It's a battle between exploitation and preservation, between the greed of powerful factions and the resilience of native populations. The fate of Kella and its inhabitants hangs in the balance, a testament to the enduring struggle for freedom and dignity in the face of oppression.",kella.png,The beautiful forests of Kella.,planets and regions
Kellis,Information broker encountered by Culkoo during her vision in the Deception trial on Votaris.,,,,people
Keltar,Planet in the Unknown Regions which was the last posting of Shauna Vex before she was betrayed and sold into slavery by her former crew.,,,,planets and regions
Kestrel,Republic medical frigate. During recovery on this vessel is when we received our orders to capture or kill Senator Brin Aldir.,,,,ships
Keyla,See Keela,,,,people
Khay,See Khaylia Koss-Starblade,,,,people
Khaybear,Treasured stuffed animal of Khaylia Starblade during her childhood.,,,,objects
Khaylia Koss-Starblade,"[Placeholder] Hottest pilot, wife, human, etc in the 'verse. During her time in Black Nebula Squadron, her call sign was BN3, while she switched to Echo 7 when she joined the Rebellion.",,khay.png,Swoon,people
Khoren,"Grey skinned humanoid with dark hair and red eyes- they look like Chiss but they are grey instead of blue. ""Ideal slave race"" according to the Imperials.",,,,people
Khrax,Bounty hunter who attacked Jira at his farmstead--recognized by Culkoo.,,,,people
Kiara,Human commander who really doesn't like us.,,,,people
King Haldor,"Former King of the planet Ulara. His son, Orm, and daughter, Krenda, were opposed with each other and supported the Republic and Imperial Remnant, respectively. He was assassinated along with Orm in a pro-Imperial plot to blame the Republic and increase Imperial influence on the heavily important strategic resources the planet had to offer.",,,,people
Kiru,Planet where Kalgus the Hutt operated and where the gangster kept a large amount of bacta stolen from the Republic. We repossessed it.,,,,planets and regions
Korath,"Powerful entity, believed to be a deity, worshipped by the Krynn. They believe the Darkstar is a fragment of this being. They wish to reshape the galaxy in its image.",,,,other entities
Korrath,See Korath,,,,other entities
Korthium Crystal,"Unique kyber crystals from Alastea, found among the less-valuable korohite crystals that were the subject of the original mining operation in the region. These crystals were the first ones we ever obatined for ourselves--with Vi even putting one in the double-bladed saber she took from Amata. Obtaining them was not easy, as the abandoned mine was still infested by vicious spiders known as Krykna.

These crystals were uniquely connected to the life force of living beings--allowing us to better and more naturally perceive nearby lifeforms.",,krykna.png,Infant form of the species infesting the mines.,objects
Koss,"Vi's family line on her father's side. Over 9,000 years BBY, the Koss family was part of a major gold rush to ancient, alien artifacts that were unearthed on Mirial. Finding, collecting, studying, and selling these objects is how the Koss famiy originally rose to power, amassing a great fortune with which to acquire yet more artifacts and other business interests.",,,,organizations
Kotala,Female Zygerian slaver who liked to beat slaves with her energy whip. She was easily dispatched by Culkoo and her garrotte. ,,,,people
Kouhuns,"Insectoid species that was contents of two tubes that Culkoo and Cho delivered. They are often used by bounty hunters to kill from a distance, and these were no different as they very likely were the weapon used in an assassination of a Chiss delegate on Coruscant.",,,,other entities
Kraymire,Settlement on Waylosh that was attacked by the Black Suns splinter group the Twin Suns. Locals were forced to work in the mines while they brought in a mobile ore processor.,,,,locations
Kreda,"Pro-Imperial daughter of King Haldor on Ulara. Advised by Koru, who we know was bad news.",,,,people
Kree,Jawa on Wolak who directed Culkoo to a job while we investigated the Shadow Collective.,,,,people
Krel,"Zabrak member of the Order of the Darkstar who, along with Jenna Terrantea, attempted to stop us from foiling the terrorist plot involving the statue of Mon Mothma. While Vi killed Jenna, Krel escaped, angry and defeated.",,,,people
Krispin,Security officer on the Eclipse.,,,,people
Krykna,Origin species of the offshoot spider species we encountered in the mines of Alastea.,"Krykna were predatory, non-sentient, spider-like creatures native to Atollon. They were resistant to blaster bolts and highly sensitive to negative emotions, making them extremely difficult to tame with the Force. They were repelled by the signal emitted by sensor beacons.",,,other entities
Krynn,"Ancient insectoid race, strong in the Dark side of the Force. Worshippers of the ""Dark Star"", they believe all who use the Force are stealing from their god. They are a mostly unknown threat to the galaxy at large,hailing literally from the Unknown Regions, but may prove its undoing if left unchecked regardless of their obscurity.",,krynn_logo_full.png,Krynn symbol,organizations
Krythara,Beautiful but enigmatic planet with bioluminous life and scenery. Location of the temple where we found the Force vergeance star map.,,,,planets and regions
Kulgus,See Kalgus the Hutt,,,,people
Kyela,See Keela,,,,people
Kyros 2,Planet that was the target of an Imperial Remnant assault around the same time we were sent to Quatham Station.,,,,planets and regions
Lady Ravana,Figure who had hidden motivations that Culkoo needed to uncover during her vision in the Deception trial on Votaris.,,,,people
Lambda,Codename for Amaya Barris,,,,people
Lamda,See Lambda,,,,people
Lanah Grottil,Deceased Jedi whose tomb we encountered in the Tomb of Vexa Chur.,,,,people
Leeonia,Leoonia (Boehle’oon),,,,people
Leoonia (Boehle’oon),8 year old Chiss navigator girl who was kidnapped on Coruscant. Ultimately rescued by us during a train job.,,,,people
Leora Tarri,See Liora Tarri,,,,people
Lessu,"Town on Ryloth built into a canyon system, where Keela was originally born and Rook was taken in by her family. A local fruit produced what Keela called ""Blue Fruit"" juice, and we asked G2P0 to take some samples to try growing it on the Bucket.",,,,locations
